"id:ID","uri","uuid","label","name","ordinal","description","data_type","role","core","value_domain","code_list","code_list_uri"
"571","https://sdtm.d4k.dk/ig/BS/BSNAM","543c3556-51f4-40c6-979c-a741cabca7e8","Vendor Name","BSNAM","20","Name or identifier of the vendor (e.g., laboratory) that provided the test results.","Char","Record Qualifier","Perm","","",""
"572","https://sdtm.d4k.dk/ig/BS/BSSPEC","ae2a26a5-68ed-4caf-ad2a-744d051324ec","Specimen Type","BSSPEC","21","Defines the type of specimen used for a measurement. Examples: SERUM, PLASMA, URINE, SOFT TISSUE.","Char","Record Qualifier","Perm","","C78734","https://ct.d4k.dk/cdisc/dataset/sc/2018-12-21/sdtm/C78734"
"573","https://sdtm.d4k.dk/ig/BS/BSANTREG","fd56da1d-0885-475c-8826-3e4d55bc9e03","Anatomical Region of Specimen","BSANTREG","22","Defines the specific anatomical or biological region of a tissue, organ specimen or the region from which the specimen is obtained, as defined in the protocol, such as a section or part of what is described in the BSSPEC variable. Examples: CORTEX, MEDULLA, MUCOSA.","Char","Variable Qualifier","Perm","","",""
"574","https://sdtm.d4k.dk/ig/BS/BSSPCCND","0455964c-232d-45a4-a4e5-e20d4152b059","Specimen Condition","BSSPCCND","23","Defines the condition of the specimen. Examples: HEMOLYZED, ICTERIC, LIPEMIC.","Char","Record Qualifier","Perm","","C78733","https://ct.d4k.dk/cdisc/dataset/sc/2018-12-21/sdtm/C78733"
"575","https://sdtm.d4k.dk/ig/BS/BSMETHOD","8c534891-7a6a-4c89-a904-6c3eb58e4b6b","Method of Test or Examination","BSMETHOD","24","Method of the test or examination. Examples: SPECTROPHOTOMETRY, ELECTROPHORESIS.","Char","Record Qualifier","Perm","","C85492","https://ct.d4k.dk/cdisc/dataset/sc/2019-03-29/sdtm/C85492"
"576","https://sdtm.d4k.dk/ig/BS/BSBLFL","c53a0d0e-93f4-4351-bac1-2649a82c9dc4","Baseline Flag","BSBLFL","25","Indicator used to identify a baseline value.","Char","Record Qualifier","Perm","","C66742","https://ct.d4k.dk/cdisc/dataset/sc/2018-12-21/send/C66742"
"577","https://sdtm.d4k.dk/ig/BS/VISITNUM","8b4c730e-0254-4c1b-8236-2f6625c44c1f","Visit Number","VISITNUM","26","Clinical encounter number. Numeric version of VISIT, used for sorting.","Num","Timing","Exp","","",""
"578","https://sdtm.d4k.dk/ig/BS/VISIT","3d0da24b-9911-46bc-92df-c2e2be24c921","Visit Name","VISIT","27","Protocol-defined description of clinical encounter.","Char","Timing","Perm","","",""
"579","https://sdtm.d4k.dk/ig/BS/VISITDY","7d7d752e-dcaf-4e7c-b07b-12af2f4feefe","Planned Study Day of Visit","VISITDY","28","Planned study day of VISIT. Should be an integer.","Num","Timing","Perm","","",""
"580","https://sdtm.d4k.dk/ig/BS/BSDTC","57574cab-8eb9-4369-989a-fc66f51e47dc","Date/Time of Specimen Collection","BSDTC","29","Date and time of specimen collection.","Char","Timing","Exp","ISO 8601 datetime or interval","",""
"581","https://sdtm.d4k.dk/ig/BS/BSDY","73b14053-5da1-4d7f-80d1-177d2950430d","Study Day of Specimen Collection","BSDY","30","Study day of specimen collection relative to the sponsor-defined RFSTDTC.","Num","Timing","Perm","","",""
"582","https://sdtm.d4k.dk/ig/BS/BSTPT","710853ba-b052-42a4-847c-c4f782dae1e0","Planned Time Point Name","BSTPT","31","Text description of time when a measurement or observation should be taken as defined in the protocol. This may be represented as an elapsed time relative to a fixed reference point, such as time of last dose. See BSTPTNUM and BSTPTREF.","Char","Timing","Perm","","",""
"583","https://sdtm.d4k.dk/ig/BS/BSTPTNUM","e59166b4-dce4-48e0-b6df-8c191d9fa7db","Planned Time Point Number","BSTPTNUM","32","Numerical version of BSTPT used in sorting.","Num","Timing","Perm","","",""
"584","https://sdtm.d4k.dk/ig/BS/BSELTM","cc56c8c7-2564-4796-a237-616cb9dcdbba","Planned Elapsed Time from Time Point Ref","BSELTM","33","Elapsed time relative to a planned fixed reference (BSTPTREF). This variable is useful where there are repetitive measures. Not a clock time or a date time variable, but an interval, represented as ISO duration.","Char","Timing","Perm","ISO 8601 duration","",""
"585","https://sdtm.d4k.dk/ig/BS/BSTPTREF","ba76e60f-12a8-46de-8d60-203d49a80a3f","Time Point Reference","BSTPTREF","34","Name of the fixed reference point referred to by BSELTM, BSTPTNUM, and BSTPT. Examples: PREVIOUS DOSE, PREVIOUS MEAL.","Char","Timing","Perm","","",""
"586","https://sdtm.d4k.dk/ig/BS/BSRFTDTC","d76ecb14-24e1-4654-953e-1551547a8b8b","Date/Time of Reference Time Point","BSRFTDTC","35","Date/time for a fixed reference time point defined by BSTPTREF.","Char","Timing","Perm","ISO 8601 datetime or interval","",""
"587","https://sdtm.d4k.dk/ig/CP/STUDYID","71821277-0228-46ad-9cb7-85a00bf4a5ef","Study Identifier","STUDYID","1","Unique identifier for a study.","Char","Identifier","Req","","",""
"588","https://sdtm.d4k.dk/ig/CP/DOMAIN","d81024e5-5f01-4d97-ad00-ed3b24ddbee4","Domain Abbreviation","DOMAIN","2","Two-character abbreviation for the domain.","Char","Identifier","Req","","",""
"589","https://sdtm.d4k.dk/ig/CP/USUBJID","03977d00-612e-4818-bfa2-cb932acc9677","Unique Subject Identifier","USUBJID","3","Identifier used to uniquely identify a subject across all studies for all applications or submissions involving the product.","Char","Identifier","Req","","",""
"590","https://sdtm.d4k.dk/ig/CP/CPSEQ","d1b42e5d-25f7-4006-afaa-1f0c1a2c9271","Sequence Number","CPSEQ","4","Sequence number to ensure uniqueness of subject records within a domain. May be any valid number.","Num","Identifier","Req","","",""
"591","https://sdtm.d4k.dk/ig/CP/CPGRPID","753a3bfd-bae3-4844-875e-56cc5da1b42b","Group ID","CPGRPID","5","Used to tie together a block of related records in a single domain for a subject.","Char","Identifier","Perm","","",""
"592","https://sdtm.d4k.dk/ig/CP/CPREFID","c822f94d-d17a-42f7-9fbc-1ebbfb4558df","Reference ID","CPREFID","6","Internal or external specimen identifier.","Char","Identifier","Perm","","",""
"593","https://sdtm.d4k.dk/ig/CP/CPSPID","5aee6274-d802-4732-acc8-8c4402e4d0ac","Sponsor-Defined Identifier","CPSPID","7","Sponsor-defined reference number. May be preprinted on the CRF as an explicit line identifier or defined in the sponsor's operational database. Example: Line number on the lab page.","Char","Identifier","Perm","","",""
"594","https://sdtm.d4k.dk/ig/CP/CPLNKID","511af100-08d8-49a7-8925-93e5025e02aa","Link ID","CPLNKID","8","Identifier used to link related records across domains. This may be a one-to-one or a one-to-many relationship.","Char","Identifier","Perm","","",""
"595","https://sdtm.d4k.dk/ig/CP/CPLNKGRP","439cf5a4-e1d8-460c-b3f7-bf07ab77dc8e","Link Group ID","CPLNKGRP","9","Identifier used to link related records across domains. This will usually be a many-to-one relationship.","Char","Identifier","Perm","","",""
"596","https://sdtm.d4k.dk/ig/CP/CPTESTCD","a2d3bb46-c5f1-45e7-b961-c911c8abe372","Test or Examination Short Name","CPTESTCD","10","Short name of the measurement, test, or examination described in CPTEST. It can be used as a column name when converting a dataset from a vertical to a horizontal format. The value in CPTESTCD cannot be longer than 8 characters, nor can it start with a number (e.g., ""1TEST"" is not valid). CPTESTCD cannot contain characters other than letters, numbers, or underscores. Examples: ""MONO"", ""MNS"".","Char","Topic","Req","","C181173","https://ct.d4k.dk/cdisc/dataset/sc/2021-09-24/sdtm/C181173"
"597","https://sdtm.d4k.dk/ig/CP/CPTEST","cd7d8cc8-c391-4609-b3e0-f7afaef32d62","Name of Measurement, Test or Examination","CPTEST","11","Long name for CPTESTCD. For cell phenotyping, the name (often abbreviated) of the cell population, as it is generally accepted by the scientific community, is populated (rather than a colloquial designation based on a primary marker, e.g., TLym Help rather than CD4). When the test is for a sublineage which can only be identified by specifying additional markers (i.e., has not been given a name) or which is further restricted to a subpopulation based on a particular cell state (e.g., activated, proliferating, apoptotic), the Sublineage Marker String (CPSBMRKS), Cell State (CPCELSTA), and Cell State Marker String (CPCSMRKS) variables are additionally populated and the value in CPTEST is suffixed with ""Sub"" to denote that it is a subset of the population identified in CPTEST (e.g., Monocytes Sub). \n The value in CPTEST cannot be longer than 40 characters.","Char","Synonym Qualifier","Req","","C181174","https://ct.d4k.dk/cdisc/dataset/sc/2021-09-24/sdtm/C181174"
"598","https://sdtm.d4k.dk/ig/CP/CPSBMRKS","ee82f7ed-53d3-472f-996d-9c3ea1ae842d","Sublineage Marker String","CPSBMRKS","12","Used to further subset the cell population identified in CPTEST based on the use of additional marker(s) that define a sublineage. The value in CPSBMRKS is used in combination with values in CPTEST and CPCELSTA to fully describe the cell population being measured. As such, it is an essential component of the full test name. \n For example, three unnamed sublineages of monocytes have been identified as: CCR2+CD16-, CCR2-CD16+, and CCR2+CD16+. Whereas the entire monocyte cell population can be defined as CD14+ cells, the additional CCR2 and CD16 markers are used to differentiate one sublineage from another. As none of these sublineages have been given names, they are only known by the CCR2 and CD16 marker combinations. By associating the CPTEST value of ""Monocytes Sub"" with, for example, a value of ""CCR2+CD16-"" in CPSBMRKS, the full test is defined to be the CCR2+CD16- monocyte subpopulation.","Char","Variable Qualifier","Perm","","",""
"599","https://sdtm.d4k.dk/ig/CP/CPCELSTA","cd5b455c-f692-4d07-86ee-5cef0155a07d","Cell State","CPCELSTA","13","A textual description of a subset of the cell population identified in CPTEST based on a particular functional and/or biological state (e.g., ""ACTIVATED"", ""PROLIFERATING"", ""SENESCENT""). When populated, the values in CPCELSTA and CPSMRKS, in combination with the values in CPTEST and CPSBMRKS, fully describe the cell population being measured.","Char","Variable Qualifier","Perm","","C181172","https://ct.d4k.dk/cdisc/dataset/sc/2021-09-24/sdtm/C181172"
"600","https://sdtm.d4k.dk/ig/CP/CPCSMRKS","128831e3-3c3f-42a4-b1a2-1628fe5c190c","Cell State Marker String","CPCSMRKS","14","Identifies the marker(s) or indicator(s) used to define the cell state (i.e., the value in CPCELSTA). \n For example, when Ki67 expression is used to determine that a cell population is in a proliferating state (i.e., CPCELSTA value=""PROLIFERATING""), the value ""Ki67+"" in CPCSMRKS indicates that positive expression of Ki67 was used to define the population as proliferating. Similarly, a value of ""Ki67-"" in CPCSMRKS would indicate that lack of expression of Ki67 defined the ""NON-PROLIFERATING"" cell state in CPCELSTA. The CPCSMRKS value is useful for quickly determining which marker(s) were used to classify (i.e., operationally define) a cell population based on a functional/biological state.","Char","Variable Qualifier","Perm","","",""
"601","https://sdtm.d4k.dk/ig/CP/CPTSTCND","36941104-487a-4bc7-95d7-a4420e21827d","Test Condition","CPTSTCND","15","Identifies any planned condition imposed by the assay system on the specimen at the time the test is performed. --TSTCND is generally used to distinguish between two or more records where the same assay is performed under varying (as opposed to fixed) conditions, usually for the purpose of making a comparison. For example, when the same assay (identified in --TEST) is performed under stimulated and non-stimulated conditions, the --TSTCND variable is used distinguish between the records.","Char","Variable Qualifier","Perm","","C181175","https://ct.d4k.dk/cdisc/dataset/sc/2021-09-24/sdtm/C181175"
"602","https://sdtm.d4k.dk/ig/CP/CPCNDAGT","9cb230db-8955-468d-bf15-64a0026b39d3","Test Condition Agent","CPCNDAGT","16","The textual description of the agent, if applicable, used to impose the condition identified in CPTSTCND. For example, records might be produced for the same assay run under stimulating (CPTSTCND value = ""STIMULATED"") conditions produced by different stimulating agents (e.g., phorbol myristate acetate, concanavalin A, PHA-P, TNF-alpha, Ionomycin, candida antigen).","Char","Record Qualifier","Perm","","",""
"603","https://sdtm.d4k.dk/ig/CP/CPBDAGNT","babdd397-e6eb-41ad-a501-287b76c6bfe7","Binding Agent","CPBDAGNT","17","The textual description of the agent that is binding to the entity in the CPTEST variable. The CPBDAGNT variable is used to indicate that there is a binding relationship between the entities in the CPTEST and CPBDAGNT variables, regardless of direction. \n The binding agent may be, but is not limited to, a test article; a portion of a test article; a substance related to a test article; an endogenous molecule; an allergen; an infectious agent; or a reagent (e.g., primary antibody) that confers the binding specificity for the measurement defined in CPTEST when it is needed to uniquely identify the test.","Char","Record Qualifier","Perm","","",""
"604","https://sdtm.d4k.dk/ig/CP/CPABCLID","97a76a62-713b-4e3e-9449-302583aa3358","Antibody Clone Identifier","CPABCLID","18","Identifies the antibody clone (e.g., supplier-provided catalog name) used to confer specificity for the binding agent specified in CPBDAGNT.","Char","Record Qualifier","Perm","","",""
"605","https://sdtm.d4k.dk/ig/CP/CPMRKSTR","20aa0354-f545-40d4-9f96-a9611a354ed0","Marker String","CPMRKSTR","19","The text string identifying the full set of markers/indicators used by the laboratory to operationally define the complete test based on the combination of CPTEST, CPSBMRKS, and CPCELSTA. Because laboratories often use different markers/indicators to identify a cell population, the relationship between a named cell population in CPTEST (as combined with CPSBMRKS and CPCELSTA values) and the set of markers used to identify that population is many-to-one. To ensure nuances important for accurately interpreting the data are accounted for and which arise from the use of different sets of markers, it is necessary to operationally define the test in terms of the complete set of markers/indicators used to perform that test.","Char","Record Qualifier","Exp","","",""
"606","https://sdtm.d4k.dk/ig/CP/CPGATE","3818c999-a783-48d9-925d-7871e3abaf3c","Gate","CPGATE","20","The sponsor-defined name assigned to a gate. Gates are electronic (i.e., a device setting or software-defined) boundaries set by a user to virtually parse a specimen into discrete populations based on a set of defined characteristics (e.g., presence, absence, or intensity of expression of various markers; physical size; internal complexity or granularity). Gates are used to constrain data collection or analysis to a specific cell population or region of interest within the specimen.","Char","Record Qualifier","Perm","","",""
"607","https://sdtm.d4k.dk/ig/CP/CPGATDEF","4a3e59a0-9268-47f9-93d5-3e507d6de973","Gate Definition","CPGATDEF","21","The text string identifying the set of parameters and the order in which they are applied to define the gating strategy. In practice, a series of 2-dimensional sub-gates based on different cell characteristics (i.e., markers/indicators/physical properties) are most often combined until the cell population of interest is sufficiently resolved (i.e., electronically isolated) from other cell populations contained within the specimen. \n For complex analyses, differences in gating strategies can produce subtle differences in results obtained for a test. To ensure nuances important for accurately interpreting the data are accounted for and which arise from the use of different gating strategies, it is often necessary to qualify the test in terms of the gating strategy. For some purposes, however, and at the discretion of the sponsor, only the ultimate or penultimate gate is identified. When specifying the gating strategy in CPGATDEF, each sub-gate should be listed in the order it was applied and separated from the next sub-gate using the pipe/vertical line (""|"") character.","Char","Record Qualifier","Perm","","",""
"608","https://sdtm.d4k.dk/ig/CP/CPSPTSTD","cfa8721c-0feb-4707-833b-38cecfd04279","Sponsor Test Description","CPSPTSTD","22","Sponsor's description of a test. The variable is intended to contain highly structured test description metadata used by a sponsor to unambiguously define (label) a test. Such values generally reside in a sponsor/laboratory test metadata repository. CPSPTSTD is not intended for unstructured (spontaneous) free text. \n An example of appropriate usage is when it is necessary to include identifying information for a target cell population on which a test is conducted when the target population is not part of the test name, e.g., tests for quantitative expression of a particular marker on a specific cell population.","Char","Record Qualifier","Perm","","",""
"609","https://sdtm.d4k.dk/ig/CP/CPCAT","16bad6b4-15da-44be-8324-d8282b2d70d0","Category","CPCAT","23","Used to define a category of topic-variable values across subjects. Examples: ""IMMUNOPHENOTYPING"", ""CELL FUNCTION"", ""TARGET ENGAGEMENT"".","Char","Grouping Qualifier","Perm","","C181171","https://ct.d4k.dk/cdisc/dataset/sc/2021-09-24/sdtm/C181171"
"610","https://sdtm.d4k.dk/ig/CP/CPSCAT","a336716d-cf98-40fa-9b2c-6686c3db5ce1","Subcategory","CPSCAT","24","A further categorization of CPCAT.","Char","Grouping Qualifier","Perm","","",""
"611","https://sdtm.d4k.dk/ig/CP/CPTSTPNL","44283adf-b7e9-4f5b-a95f-a492f49e1024","Test Panel","CPTSTPNL","25","Sponsor-defined textual description used to group tests run together as part of a test panel. Can be used with --GRPID to ensure that relationships between associated tests are accurately identified.","Char","Grouping Qualifier","Perm","","",""
"612","https://sdtm.d4k.dk/ig/CP/CPORRES","49ba6a9e-8724-4cd6-8489-481a7d19ed6b","Result or Finding in Original Units","CPORRES","26","Result of the measurement or finding as originally received or collected.","Char","Result Qualifier","Exp","","",""
"613","https://sdtm.d4k.dk/ig/CP/CPORRESU","0ece6b70-bfab-408d-a485-1ddeab573f03","Original Units","CPORRESU","27","Original units in which the data were collected. The unit for CPORRES. Examples: ""10^6/L"", ""%"", ""MESF"".","Char","Variable Qualifier","Perm","","C71620","https://ct.d4k.dk/cdisc/dataset/sc/2018-12-21/sdtm/C71620"
"614","https://sdtm.d4k.dk/ig/CP/CPRESSCL","fc34ad59-f4da-4aaf-8aba-046a5b30e68e","Result Scale","CPRESSCL","28","Classifies the scale of the original result value with respect to whether the result is quantitative, ordinal, nominal, or narrative.","Char","Record Qualifier","Perm","","C177910","https://ct.d4k.dk/cdisc/dataset/sc/2021-03-26/sdtm/C177910"
"615","https://sdtm.d4k.dk/ig/CP/CPRESTYP","368e4636-b258-408e-b80d-f04996c2a38e","Result Type","CPRESTYP","29","Classifies the kind of result (i.e., property type) originally reported for the test. Examples: ""NUMBER CONCENTRATION"", ""NUMBER FRACTION"", ""RATIO"".","Char","Record Qualifier","Perm","","C179588","https://ct.d4k.dk/cdisc/dataset/sc/2021-06-25/sdtm/C179588"
"616","https://sdtm.d4k.dk/ig/CP/CPCOLSRT","ea287979-462e-4c74-bfa3-36383ed445ed","Collected Summary Result Type","CPCOLSRT","30","Used to indicate the type of collected summary result. This includes source summary results collected on a CRF or provided by an external vendor (e.g., central lab). If the summary result is derived using individual source data records, this summary result should be represented in ADaM. If a sponsor has both a collected summary result and a derived summary result, the collected summary result should be represented in SDTM and the derived summary result should be represented in ADaM.","Char","Record Qualifier","Perm","","C177908","https://ct.d4k.dk/cdisc/dataset/sc/2021-03-26/sdtm/C177908"
"617","https://sdtm.d4k.dk/ig/CP/CPORNRLO","a8d9a009-3896-4f2c-8c9a-5c9d32a37c8b","Reference Range Lower Limit in Orig Unit","CPORNRLO","31","Lower end of reference range for continuous measurement in original units. Should be populated only for continuous results.","Char","Variable Qualifier","Perm","","",""
"618","https://sdtm.d4k.dk/ig/CP/CPORNRHI","88a06a9b-c2ca-490c-8a24-f0c6dfb62ad6","Reference Range Upper Limit in Orig Unit","CPORNRHI","32","Upper end of reference range for continuous measurement in original units. Should be populated only for continuous results.","Char","Variable Qualifier","Perm","","",""
"619","https://sdtm.d4k.dk/ig/CP/CPSTRESC","5218e554-a5a5-4b2f-a3d9-e97b42c5eb16","Result or Finding in Standard Format","CPSTRESC","33","Contains the result value for all findings, copied or derived from CPORRES in a standard format or in standard units. CPSTRESC should store all results or findings in character format; if results are numeric, they should also be stored in numeric format in CPSTRESN.","Char","Result Qualifier","Exp","","",""
"620","https://sdtm.d4k.dk/ig/CP/CPSTRESN","83dc450b-e3bb-4e7d-b46b-a4983ca41b7e","Numeric Result/Finding in Standard Units","CPSTRESN","34","Used for continuous or numeric results or findings in standard format; copied in numeric format from CPSTRESC. CPSTRESN should store all numeric test results or findings.","Num","Result Qualifier","Perm","","",""
"621","https://sdtm.d4k.dk/ig/CP/CPSTRESU","a52d0a64-aa7e-4b31-b098-d4e66f64c077","Standard Units","CPSTRESU","35","Standardized unit used for CPSTRESC or CPSTRESN.","Char","Variable Qualifier","Perm","","C71620","https://ct.d4k.dk/cdisc/dataset/sc/2018-12-21/sdtm/C71620"
"622","https://sdtm.d4k.dk/ig/CP/CPSTNRLO","5007fc43-fef4-4875-8092-1e951654c265","Reference Range Lower Limit-Std Units","CPSTNRLO","36","Lower end of reference range for continuous measurements for CPSTRESC/CPSTRESN in standardized units. Should be populated only for continuous results.","Num","Variable Qualifier","Perm","","",""
"623","https://sdtm.d4k.dk/ig/CP/CPSTNRHI","85dd7b8f-1f40-4baa-a378-642a0029616d","Reference Range Upper Limit-Std Units","CPSTNRHI","37","Upper end of reference range for continuous measurements in standardized units. Should be populated only for continuous results.","Num","Variable Qualifier","Perm","","",""
"624","https://sdtm.d4k.dk/ig/CP/CPNRIND","cd7b5905-4c87-44d7-b41d-0479fe2c6738","Reference Range Indicator","CPNRIND","38","Indicates where the value falls with respect to reference range defined by CPORNRLO and CPORNRHI, CPSTNRLO and CPSTNRHI, or by CPSTNRC. Examples: ""NORMAL"", ""ABNORMAL"", ""HIGH"", ""LOW"". Sponsors should specify in the study metadata (Comments column in the Define-XML document) whether CPNRIND refers to the original or standard reference ranges and results. CPNRIND should not be used to indicate clinical significance.","Char","Variable Qualifier","Perm","","C78736","https://ct.d4k.dk/cdisc/dataset/sc/2019-03-29/sdtm/C78736"
"625","https://sdtm.d4k.dk/ig/CP/CPSTAT","471ed273-3828-4582-9bd2-5f4b4d330cee","Completion Status","CPSTAT","39","Used to indicate that the test was not performed or that it was attempted but did not generate a result. Should be null if a result exists in CPORRES.","Char","Record Qualifier","Perm","","C66789","https://ct.d4k.dk/cdisc/dataset/sc/2018-12-21/send/C66789"
"626","https://sdtm.d4k.dk/ig/CP/CPREASND","4a4f5d52-0777-4b56-b5a1-f4ef15d507c6","Reason Not Done","CPREASND","40","Describes why a test was not performed, e.g., ""BROKEN EQUIPMENT"", ""SUBJECT REFUSED"", ""SPECIMEN LOST"". Used in conjunction with CPSTAT when value is ""NOT DONE"".","Char","Record Qualifier","Perm","","",""
"627","https://sdtm.d4k.dk/ig/CP/CPNAM","87cb3d5f-7fbe-443a-969a-ce2222d2f194","Vendor Name","CPNAM","41","The name or identifier of the laboratory that performed the test.","Char","Record Qualifier","Perm","","",""
"628","https://sdtm.d4k.dk/ig/CP/CPLOINC","4a23179c-42e6-4c98-a58f-d769062d4566","LOINC Code","CPLOINC","42","Code for the test from the LOINC code system. The sponsor is expected to provide the dictionary name and version used to map the terms utilizing the Define-XML external codelist attributes.","Char","Synonym Qualifier","Perm","LOINC","",""
"629","https://sdtm.d4k.dk/ig/CP/CPSPEC","51eebfba-9df3-45cf-a2c6-9fdf82154fb7","Specimen Type","CPSPEC","43","Defines the type of specimen used for a measurement. Examples: ""BLOOD"", ""BONE MARROW"".","Char","Record Qualifier","Perm","","C78734","https://ct.d4k.dk/cdisc/dataset/sc/2018-12-21/sdtm/C78734"
"630","https://sdtm.d4k.dk/ig/CP/CPSPCCND","916d332d-1306-48c4-8c94-c028322fd0b0","Specimen Condition","CPSPCCND","44","The physical state or quality of a specimen for an assessment. Example: ""CLOTTED"".","Char","Record Qualifier","Perm","","C78733","https://ct.d4k.dk/cdisc/dataset/sc/2018-12-21/sdtm/C78733"
"631","https://sdtm.d4k.dk/ig/CP/CPMETHOD","c2a0c7a3-eacd-4da9-a6e2-79ec51f62c99","Method of Test or Examination","CPMETHOD","45","Method of the test or examination. Example: ""FLOW CYTOMETRY"".","Char","Record Qualifier","Perm","","C85492","https://ct.d4k.dk/cdisc/dataset/sc/2019-03-29/sdtm/C85492"
"632","https://sdtm.d4k.dk/ig/CP/CPANMETH","3c0d5703-6ee9-46b6-af7d-9e0a9e1b94f6","Analysis Method","CPANMETH","46","Analysis method applied to obtain a summarized result. Analysis method describes the method of secondary processing applied to a complex observation result.","Char","Record Qualifier","Perm","","",""
"633","https://sdtm.d4k.dk/ig/CP/CPLOBXFL","a42df129-6f50-4b52-91ef-1d37bd55efd3","Last Observation Before Exposure Flag","CPLOBXFL","47","Operationally-derived indicator used to identify the last non-missing value prior to RFXSTDTC. The value should be ""Y"" or null.","Char","Record Qualifier","Perm","","C66742","https://ct.d4k.dk/cdisc/dataset/sc/2018-12-21/send/C66742"
