"id:ID","uri","uuid","label","name","ordinal","description","data_type","role","core","value_domain","code_list","code_list_uri"
"1033","https://sdtm.d4k.dk/ig/MB/MBMETHOD","3a2dda61-386d-4b5d-8710-a3dff69d222b","Method of Test or Examination","MBMETHOD","31","Method of the test or examination. Examples: ""GRAM STAIN"", ""MICROBIAL CULTURE, LIQUID"", ""QUANTITATIVE REVERSE TRANSCRIPTASE POLYMERASE CHAIN REACTION"".","Char","Record Qualifier","Exp","","C85492","https://ct.d4k.dk/cdisc/dataset/sc/2019-03-29/sdtm/C85492"
"1034","https://sdtm.d4k.dk/ig/MB/MBLOBXFL","1ed7607e-e5ad-4047-891a-1d2185d7d5ca","Last Observation Before Exposure Flag","MBLOBXFL","32","Operationally derived indicator used to identify the last non-missing value prior to RFXSTDTC. The value should be ""Y"" or null.","Char","Record Qualifier","Perm","","C66742","https://ct.d4k.dk/cdisc/dataset/sc/2018-12-21/send/C66742"
"1035","https://sdtm.d4k.dk/ig/MB/MBBLFL","6fccfcd0-9d63-4a46-b0b4-2f8d79088068","Baseline Flag","MBBLFL","33","Indicator used to identify a baseline value. Should be ""Y"" or null. Note that MBBLFL is retained for backward compatibility. The authoritative baseline for statistical analysis is in an ADaM dataset.","Char","Record Qualifier","Perm","","C66742","https://ct.d4k.dk/cdisc/dataset/sc/2018-12-21/send/C66742"
"1036","https://sdtm.d4k.dk/ig/MB/MBFAST","d0c24b5c-27bc-47c7-86ae-3ffdb5abf908","Fasting Status","MBFAST","34","Indicator used to identify fasting status. Valid values include ""Y"", ""N"", ""U"", or null if not relevant.","Char","Record Qualifier","Perm","","C66742","https://ct.d4k.dk/cdisc/dataset/sc/2018-12-21/send/C66742"
"1037","https://sdtm.d4k.dk/ig/MB/MBDRVFL","36dc7c23-f748-4db1-b986-faaef5ae5379","Derived Flag","MBDRVFL","35","Used to indicate a derived record (e.g., a record that represents the average of other records such as a computed baseline). Should be ""Y"" or null.","Char","Record Qualifier","Perm","","C66742","https://ct.d4k.dk/cdisc/dataset/sc/2018-12-21/send/C66742"
"1038","https://sdtm.d4k.dk/ig/MB/VISITNUM","a014d915-bd83-4277-b3cf-054d217ec5e4","Visit Number","VISITNUM","36","Clinical encounter number. Numeric version of VISIT, used for sorting.","Num","Timing","Exp","","",""
"1039","https://sdtm.d4k.dk/ig/MB/VISIT","c656e4a2-ec64-418c-bda4-380d36031f6f","Visit Name","VISIT","37","Protocol-defined description of a clinical encounter.","Char","Timing","Perm","","",""
"1040","https://sdtm.d4k.dk/ig/MB/VISITDY","1f5e63b4-d058-4640-b5ef-e8faf9c366ce","Planned Study Day of Visit","VISITDY","38","Planned study day of VISIT. Should be an integer.","Num","Timing","Perm","","",""
"1041","https://sdtm.d4k.dk/ig/MB/TAETORD","82391859-9514-430f-9509-2e9185b7e06f","Planned Order of Element within Arm","TAETORD","39","Number that gives the planned order of the element within the arm for the element which the specimen collection occurred.","Num","Timing","Perm","","",""
"1042","https://sdtm.d4k.dk/ig/MB/EPOCH","373130d0-6180-4554-84c3-329528fc430b","Epoch","EPOCH","40","Epoch associated with the date/time at which the specimen was collected.","Char","Timing","Perm","","C99079","https://ct.d4k.dk/cdisc/dataset/sc/2019-03-29/sdtm/C99079"
"1043","https://sdtm.d4k.dk/ig/MB/MBDTC","6551072a-ef83-4a74-b355-14d853a9c4ae","Date/Time of Collection","MBDTC","41","Date/time of specimen collection.","Char","Timing","Exp","ISO 8601 datetime or interval","",""
"1044","https://sdtm.d4k.dk/ig/MB/MBDY","446bff43-6014-49bd-8c60-3118d50cf88a","Study Day of Visit/Collection/Exam","MBDY","42","Study day of the specimen collection, measured as integer days. Algorithm for calculations must be relative to the sponsor-defined RFSTDTC variable in Demographics. This formula should be consistent across the submission.","Num","Timing","Perm","","",""
"1045","https://sdtm.d4k.dk/ig/MB/MBTPT","e4e67cad-eed1-4973-a3f1-13fbd89bb1d8","Planned Time Point Name","MBTPT","43","Text description of time when specimen should be taken. This may be represented as an elapsed time relative to a fixed reference point, such as time of last dose. See MBTPTNUM and MBTPTREF. Examples: ""Start"", ""5 min post"".","Char","Timing","Perm","","",""
"1046","https://sdtm.d4k.dk/ig/MB/MBTPTNUM","8885524d-81ba-418e-8509-eaaf22d5e7b7","Planned Time Point Number","MBTPTNUM","44","Numeric version of MBTPT used in sorting.","Num","Timing","Perm","","",""
"1047","https://sdtm.d4k.dk/ig/MB/MBELTM","299f2d8b-4a47-4250-b4de-c9affca28a94","Planned Elapsed Time from Time Point Ref","MBELTM","45","Planned elapsed time (in ISO 8601) relative to a planned fixed reference (MBTPTREF). This variable is useful where there are repetitive measures. Not a clock time or a date time variable. Represented as an ISO 8601 duration. Examples: ""-PT15M"" to represent the period of 15 minutes prior to the reference point indicated by MBTPTREF, or ""PT8H"" to represent the period of 8 hours after the reference point indicated by MBTPTREF.","Char","Timing","Perm","ISO 8601 duration","",""
"1048","https://sdtm.d4k.dk/ig/MB/MBTPTREF","edb5a872-2b42-402b-9f7d-e3f9ad16215b","Time Point Reference","MBTPTREF","46","Name of the fixed reference point referred to by MBELTM, MBTPTNUM, and MBTPT. Example: ""PREVIOUS DOSE"".","Char","Timing","Perm","","",""
"1049","https://sdtm.d4k.dk/ig/MB/MBRFTDTC","e3dd75a0-4acb-4e47-9b7b-787f7d60759c","Date/Time of Reference Time Point","MBRFTDTC","47","Date/time for a fixed reference time point, MBTPTREF.","Char","Timing","Perm","ISO 8601 datetime or interval","",""
"1050","https://sdtm.d4k.dk/ig/MI/STUDYID","6ea5b455-26dc-4730-93c4-4db8a4e90e54","Study Identifier","STUDYID","1","Unique identifier for a study.","Char","Identifier","Req","","",""
"1051","https://sdtm.d4k.dk/ig/MI/DOMAIN","c63089db-b48a-40eb-854d-9e4eaadd3b25","Domain Abbreviation","DOMAIN","2","Two-character abbreviation for the domain.","Char","Identifier","Req","","",""
"1052","https://sdtm.d4k.dk/ig/MI/USUBJID","58c9027f-64fb-40b2-ad0d-8ce10ab8c166","Unique Subject Identifier","USUBJID","3","Identifier used to uniquely identify a subject across all studies for all applications or submissions involving the product.","Char","Identifier","Req","","",""
"1053","https://sdtm.d4k.dk/ig/MI/MISEQ","425c2ffd-3bac-4349-adfb-303dd553177d","Sequence Number","MISEQ","4","Sequence number given to ensure uniqueness of subject records within a domain. May be any valid number.","Num","Identifier","Req","","",""
"1054","https://sdtm.d4k.dk/ig/MI/MIGRPID","643506c5-bc65-4b04-a446-026c103ec0b1","Group ID","MIGRPID","5","Used to tie together a block of related records in a single domain for a subject. This is not the treatment group number.","Char","Identifier","Perm","","",""
"1055","https://sdtm.d4k.dk/ig/MI/MIREFID","bc0ee4af-c0fe-4ba2-b265-6cab894f253f","Reference ID","MIREFID","6","Internal or external specimen identifier. Example: specimen barcode number.","Char","Identifier","Perm","","",""
"1056","https://sdtm.d4k.dk/ig/MI/MISPID","609eb85b-abf4-4018-901b-10a0633eb7a1","Sponsor-Defined Identifier","MISPID","7","Sponsor-defined reference number. May be printed on the CRF as an explicit line identifier or defined in the sponsor's operational database. Example: line number from the MI Findings page.","Char","Identifier","Perm","","",""
"1057","https://sdtm.d4k.dk/ig/MI/MITESTCD","a71f16b8-9ebd-4e5f-8e6a-1d053f4ac063","Microscopic Examination Short Name","MITESTCD","8","Short name of the measurement, test, or examination described in MITEST. It can be used as a column name when converting a dataset from a vertical to a horizontal format. The value in MITESTCD cannot be longer than 8 characters, nor can it start with a number (e.g., ""1TEST"" is not valid). MITESTCD cannot contain characters other than letters, numbers, or underscores. Examples: ""HER2"", ""BRCA1"", ""TTF1"".","Char","Topic","Req","","C132263","https://ct.d4k.dk/cdisc/dataset/sc/2018-12-21/sdtm/C132263"
"1058","https://sdtm.d4k.dk/ig/MI/MITEST","634527e8-acfc-4aa9-bab0-afcddd1a9e99","Microscopic Examination Name","MITEST","9","Verbatim name of the test or examination used to obtain the measurement or finding. The value in MITEST cannot be longer than 40 characters. Examples: ""Human Epidermal Growth Factor Receptor 2"", ""Breast Cancer Susceptibility Gene 1"", ""Thyroid Transcription Factor 1"".","Char","Synonym Qualifier","Req","","C132262","https://ct.d4k.dk/cdisc/dataset/sc/2018-12-21/sdtm/C132262"
"1059","https://sdtm.d4k.dk/ig/MI/MITSTDTL","322d0483-c403-41a0-a3d9-8a7d74dc89b1","Microscopic Examination Detail","MITSTDTL","10","Further description of the test performed in producing the MI result. This would be used to represent specific attributes, such as intensity score or percentage of cells displaying presence of the biomarker or compound.","Char","Record Qualifier","Perm","","C125922","https://ct.d4k.dk/cdisc/dataset/sc/2019-03-29/sdtm/C125922"
"1060","https://sdtm.d4k.dk/ig/MI/MICAT","0e19dbfe-e75d-4e2d-83a7-1d57a3f96331","Category for Microscopic Finding","MICAT","11","Used to define a category of related records.","Char","Grouping Qualifier","Perm","","",""
"1061","https://sdtm.d4k.dk/ig/MI/MISCAT","043ab1b0-5837-4ec8-9e26-2d64a55d0284","Subcategory for Microscopic Finding","MISCAT","12","Used to define a further categorization of MICAT.","Char","Grouping Qualifier","Perm","","",""
"1062","https://sdtm.d4k.dk/ig/MI/MIORRES","2a0b8c28-8db3-431a-8918-5776cbe49bc0","Result or Finding in Original Units","MIORRES","13","Result of the histopathology measurement or finding as originally received or collected.","Char","Result Qualifier","Exp","","",""
"1063","https://sdtm.d4k.dk/ig/MI/MIORRESU","50f129f5-c708-48da-a375-b17efa68da6c","Original Units","MIORRESU","14","Original unit for MIORRES.","Char","Variable Qualifier","Perm","","C71620","https://ct.d4k.dk/cdisc/dataset/sc/2018-12-21/sdtm/C71620"
"1064","https://sdtm.d4k.dk/ig/MI/MISTRESC","e1e46dd9-513d-4f00-a6af-e1fe01cbec85","Character Result/Finding in Std Format","MISTRESC","15","Contains the result value for all findings, copied or derived from MIORRES in a standard format or standard units. MISTRESC should store all results or findings in character format; if results are numeric, they should also be stored in numeric format in MISTRESN.","Char","Result Qualifier","Exp","","",""
"1065","https://sdtm.d4k.dk/ig/MI/MISTRESN","66337366-3432-4233-a88c-eaf3d5d2b679","Numeric Result/Finding in Standard Units","MISTRESN","16","Used for continuous or numeric results or findings in standard format; copied in numeric format from MISTRESC. MISTRESN should store all numeric test results or findings.","Num","Result Qualifier","Perm","","",""
"1066","https://sdtm.d4k.dk/ig/MI/MISTRESU","831fce41-083e-4af2-9212-a8734f5a952b","Standard Units","MISTRESU","17","Standardized unit used for MISTRESC and MISTRESN.","Char","Variable Qualifier","Perm","","C71620","https://ct.d4k.dk/cdisc/dataset/sc/2018-12-21/sdtm/C71620"
"1067","https://sdtm.d4k.dk/ig/MI/MIRESCAT","5c62608c-1415-4601-abd6-7851ff137726","Result Category","MIRESCAT","18","Used to categorize the result of a finding. Examples: ""MALIGNANT"" or ""BENIGN"" for tumor findings.","Char","Variable Qualifier","Perm","","",""
"1068","https://sdtm.d4k.dk/ig/MI/MISTAT","f4badc83-1bf9-47ee-8ad0-655b010ac7bd","Completion Status","MISTAT","19","Used to indicate examination not done or result is missing. Should be null if a result exists in MIORRES or have a value of ""NOT DONE"" when MIORRES = ""NULL"".","Char","Record Qualifier","Perm","","C66789","https://ct.d4k.dk/cdisc/dataset/sc/2018-12-21/send/C66789"
"1069","https://sdtm.d4k.dk/ig/MI/MIREASND","d96bc311-e74f-4e41-8169-2219173f72e5","Reason Not Done","MIREASND","20","Reason not done. Used in conjunction with MISTAT when value is NOT DONE. Examples: ""SAMPLE AUTOLYZED"", ""SPECIMEN LOST"".","Char","Record Qualifier","Perm","","",""
"1070","https://sdtm.d4k.dk/ig/MI/MINAM","4b86ddc3-5dba-47e6-badf-b4fe280359e5","Laboratory/Vendor Name","MINAM","21","Name or identifier of the vendor (e.g., laboratory) that provided the test results.","Char","Record Qualifier","Perm","","",""
"1071","https://sdtm.d4k.dk/ig/MI/MISPEC","c16967cc-0761-47ac-878b-82f1480cc79e","Specimen Material Type","MISPEC","22","Subject of the observation. Defines the type of specimen used for a measurement. Examples: ""TISSUE"", ""BLOOD"", ""BONE MARROW"".","Char","Record Qualifier","Req","","C78734","https://ct.d4k.dk/cdisc/dataset/sc/2018-12-21/sdtm/C78734"
"1072","https://sdtm.d4k.dk/ig/MI/MISPCCND","08f70a95-7ee1-43fc-b11a-ef885d5d100f","Specimen Condition","MISPCCND","23","Free or standardized text describing the condition of the specimen. Example: ""AUTOLYZED"".","Char","Record Qualifier","Exp","","C78733","https://ct.d4k.dk/cdisc/dataset/sc/2018-12-21/sdtm/C78733"
"1073","https://sdtm.d4k.dk/ig/MI/MILOC","9f6353e3-2018-496d-a93b-628c4cf120cd","Specimen Collection Location","MILOC","24","Location relevant to the collection of the specimen. Examples: ""LUNG"", ""KNEE JOINT"", ""ARM"", ""THIGH"".","Char","Record Qualifier","Perm","","C74456","https://ct.d4k.dk/cdisc/dataset/sc/2018-12-21/send/C74456"
"1074","https://sdtm.d4k.dk/ig/MI/MILAT","7d00f7d8-e287-40ba-aa50-da900066f037","Specimen Laterality within Subject","MILAT","25","Qualifier for laterality of the location of the specimen in MILOC. Examples: ""LEFT"", ""RIGHT"", ""BILATERAL"".","Char","Variable Qualifier","Perm","","C99073","https://ct.d4k.dk/cdisc/dataset/sc/2018-12-21/send/C99073"
"1075","https://sdtm.d4k.dk/ig/MI/MIDIR","897d9a41-78a5-4407-9e95-46c5ec60b104","Specimen Directionality within Subject","MIDIR","26","Qualifier for directionality of the location of the specimen in MILOC. Examples: ""DORSAL"", ""PROXIMAL"".","Char","Variable Qualifier","Perm","","C99074","https://ct.d4k.dk/cdisc/dataset/sc/2018-12-21/send/C99074"
"1076","https://sdtm.d4k.dk/ig/MI/MIMETHOD","8dec2d67-86e3-4de1-a5c6-af36fe9a1008","Method of Test or Examination","MIMETHOD","27","Method of the test or examination. This could include the technique or type of staining used for the slides. Examples: ""IHC"", ""Crystal violet"", ""Safranin"", ""Trypan blue"", or ""Propidium iodide"".","Char","Record Qualifier","Perm","","C85492","https://ct.d4k.dk/cdisc/dataset/sc/2019-03-29/sdtm/C85492"
"1077","https://sdtm.d4k.dk/ig/MI/MILOBXFL","4fef267a-9387-416a-8746-ce4d8111c396","Last Observation Before Exposure Flag","MILOBXFL","28","Operationally derived indicator used to identify the last non-missing value prior to RFXSTDTC. The value should be ""Y"" or null.","Char","Record Qualifier","Exp","","C66742","https://ct.d4k.dk/cdisc/dataset/sc/2018-12-21/send/C66742"
"1078","https://sdtm.d4k.dk/ig/MI/MIBLFL","e39f12ac-4036-4e95-a063-5f1ae742cf6e","Baseline Flag","MIBLFL","29","Indicator used to identify a baseline value. The value should be ""Y"" or null. Note that MIBLFL is retained for backward compatibility. The authoritative baseline flag for statistical analysis is in an ADaM dataset.","Char","Record Qualifier","Perm","","C66742","https://ct.d4k.dk/cdisc/dataset/sc/2018-12-21/send/C66742"
"1079","https://sdtm.d4k.dk/ig/MI/MIEVAL","1288408f-66bb-45eb-b7fa-16cbb02dd743","Evaluator","MIEVAL","30","Role of the person who provided the evaluation. Example: ""PATHOLOGIST"", ""PEER REVIEW"", ""SPONSOR PATHOLOGIST"".","Char","Record Qualifier","Perm","","C78735","https://ct.d4k.dk/cdisc/dataset/sc/2019-03-29/sdtm/C78735"
"1080","https://sdtm.d4k.dk/ig/MI/VISITNUM","6e73a9c5-50c0-49ad-8075-76c5365cfdcd","Visit Number","VISITNUM","31","Clinical encounter number. Numeric version of VISIT, used for sorting.","Num","Timing","Exp","","",""
"1081","https://sdtm.d4k.dk/ig/MI/VISIT","c1523007-dcee-46ec-afdc-475c91da05ec","Visit Name","VISIT","32","Protocol-defined description of clinical encounter. May be used in addition to VISITNUM and/or VISITDY.","Char","Timing","Perm","","",""
"1082","https://sdtm.d4k.dk/ig/MI/VISITDY","99ffaa7d-6bb5-42a0-bb04-5449ff9bf8e7","Planned Study Day of Visit","VISITDY","33","Planned study day of the visit based upon RFSTDTC in Demographics.","Num","Timing","Perm","","",""
"1083","https://sdtm.d4k.dk/ig/MI/TAETORD","05ea4b6d-4e2e-4743-9019-e06c545a1120","Planned Order of Element within Arm","TAETORD","34","Number that gives the planned order of the element within the arm for the element in which the assessment was made.","Num","Timing","Perm","","",""
"1084","https://sdtm.d4k.dk/ig/MI/EPOCH","3df2b384-26ab-420e-8425-84e072e29f2b","Epoch","EPOCH","35","Epoch associated with the date/time at which the specimen was collected.","Char","Timing","Perm","","C99079","https://ct.d4k.dk/cdisc/dataset/sc/2019-03-29/sdtm/C99079"
"1085","https://sdtm.d4k.dk/ig/MI/MIDTC","34105880-3082-48be-9748-4947168b4686","Date/Time of Specimen Collection","MIDTC","36","Date/time of specimen collection, in ISO 8601 format.","Char","Timing","Exp","ISO 8601 datetime or interval","",""
"1086","https://sdtm.d4k.dk/ig/MI/MIDY","ce5ea40e-7a09-4c60-9965-676e886b0bb9","Study Day of Specimen Collection","MIDY","37","Study day of specimen collection, in integer days. The algorithm for calculations must be relative to the sponsor-defined RFSTDTC variable in the Demographics (DM) domain.","Num","Timing","Perm","","",""
"1087","https://sdtm.d4k.dk/ig/MK/STUDYID","e87fae6c-47fd-420d-9fc1-dc2952af3e5d","Study Identifier","STUDYID","1","Unique identifier for a study.","Char","Identifier","Req","","",""
"1088","https://sdtm.d4k.dk/ig/MK/DOMAIN","e8f0d2e1-f7e8-4c91-8af9-ce8147158a38","Domain Abbreviation","DOMAIN","2","Two-character abbreviation for the domain.","Char","Identifier","Req","","",""
"1089","https://sdtm.d4k.dk/ig/MK/USUBJID","899ed944-c196-40c5-93c9-c21e67fed4c3","Unique Subject Identifier","USUBJID","3","Identifier used to uniquely identify a subject across all studies for all applications or submissions involving the product.","Char","Identifier","Req","","",""
"1090","https://sdtm.d4k.dk/ig/MK/MKSEQ","74b5d8e6-0c60-4faf-9152-84e9d25c130b","Sequence Number","MKSEQ","4","Sequence number to ensure uniqueness of records within a dataset for a subject (or within a parameter, in the case of the Trial Summary domain). May be any valid number (including decimals) and does not have to start at 1.","Num","Identifier","Req","","",""
"1091","https://sdtm.d4k.dk/ig/MK/MKGRPID","84dbe1f5-e134-43d5-a19b-b6dd73668a6c","Group ID","MKGRPID","5","Used to link together a block of related records within a subject in a domain.","Char","Identifier","Perm","","",""
"1092","https://sdtm.d4k.dk/ig/MK/MKREFID","dc320e13-d4c5-4b27-b726-b860d7b13962","Reference ID","MKREFID","6","Optional internal or external identifier such as lab specimen ID or a medical image.","Char","Identifier","Perm","","",""
"1093","https://sdtm.d4k.dk/ig/MK/MKSPID","d88497b2-e0e2-42a3-99ef-9ec0bccc355f","Sponsor-Defined Identifier","MKSPID","7","Sponsor-defined identifier. Example: Preprinted line identifier on a Concomitant Medications page.","Char","Identifier","Perm","","",""
"1094","https://sdtm.d4k.dk/ig/MK/MKLNKID","3ae2abdd-04a7-4b34-9518-2ece30f5753f","Link ID","MKLNKID","8","Identifier used to link related records across domains. This may be a one-to-one or a one-to-many relationship.","Char","Identifier","Perm","","",""
"1095","https://sdtm.d4k.dk/ig/MK/MKLNKGRP","ad0a1312-7111-450c-985b-6406c5866569","Link Group ID","MKLNKGRP","9","Identifier used to link related records across domains. This will usually be a many-to-one relationship.","Char","Identifier","Perm","","",""
"1096","https://sdtm.d4k.dk/ig/MK/MKTESTCD","818c5cb6-671d-4f60-81f7-9567d1482d1b","Short Name of Musculoskeletal Test","MKTESTCD","10","Short character value for MKTEST used as a column name when converting a dataset from a vertical format to a horizontal format. The value in MKTESTCD cannot be longer than 8 characters, nor can it start with a number (e.g., ""1TEST"" is not valid). MKTESTCD cannot contain characters other than letters, numbers, or underscores. Examples: ""TNDRIND"", ""SWLLIND"", ""SGJSNSCR"".","Char","Topic","Req","","C127269","https://ct.d4k.dk/cdisc/dataset/sc/2019-03-29/sdtm/C127269"
"1097","https://sdtm.d4k.dk/ig/MK/MKTEST","2f6ef9a3-95ae-4fc1-b8ed-ccaeed9a50d3","Name of Musculoskeletal Test","MKTEST","11","Long name For MKTESTCD. Examples: ""Tenderness Indicator"", ""Swollen Indicator"", ""Sharp/Genant JSN Score"".","Char","Synonym Qualifier","Req","","C127270","https://ct.d4k.dk/cdisc/dataset/sc/2019-03-29/sdtm/C127270"
"1098","https://sdtm.d4k.dk/ig/MK/MKCAT","f6eb8c40-2c85-40c6-8270-e1035b35fd8a","Category for Musculoskeletal Test","MKCAT","12","Used to define a category of topic-variable values. Examples: ""SWOLLEN/TENDER JOINT ASSESSMENT"".","Char","Grouping Qualifier","Perm","","",""
"1099","https://sdtm.d4k.dk/ig/MK/MKSCAT","f54b293c-9118-4bd6-9387-40e2a8cdc4d3","Subcategory for Musculoskeletal Test","MKSCAT","13","Used to define a further categorization of MKCAT values.","Char","Grouping Qualifier","Perm","","",""
"1100","https://sdtm.d4k.dk/ig/MK/MKPOS","6bb3ae17-a33b-4a8e-9647-b9fbc5aaaa47","Position of Subject","MKPOS","14","Position of the subject during a measurement or examination. Examples: ""SUPINE"", ""STANDING"", ""SITTING"".","Char","Record Qualifier","Perm","","C71148","https://ct.d4k.dk/cdisc/dataset/sc/2018-12-21/send/C71148"
"1101","https://sdtm.d4k.dk/ig/MK/MKORRES","282744ec-6f1b-489c-9ed5-2634c650cc6c","Result or Finding in Original Units","MKORRES","15","Result of the measurement or finding as originally received or collected.","Char","Result Qualifier","Exp","","",""
"1102","https://sdtm.d4k.dk/ig/MK/MKORRESU","49befe5f-102d-404b-bcaa-cf591ce079cb","Original Units","MKORRESU","16","Unit for MKORRES.","Char","Variable Qualifier","Perm","","C71620","https://ct.d4k.dk/cdisc/dataset/sc/2018-12-21/sdtm/C71620"
"1103","https://sdtm.d4k.dk/ig/MK/MKSTRESC","6a95be63-08ec-4f11-b568-5f1380be4aa9","Character Result/Finding in Std Format","MKSTRESC","17","Contains the result value for all findings, copied or derived from MKORRES in a standard format or in standard units. MKSTRESC should store all results or findings in character format; if results are numeric, they should also be stored in numeric format in MKSTRESN. For example, if various tests have results ""NONE"", ""NEG"", and ""NEGATIVE"" in MKORRES and these results effectively have the same meaning, they could be represented in standard format in MKSTRESC as ""NEGATIVE"".","Char","Result Qualifier","Exp","","",""
"1104","https://sdtm.d4k.dk/ig/MK/MKSTRESN","6f68ea0b-3bf3-4165-a716-eb52b7588a6a","Numeric Result/Finding in Standard Units","MKSTRESN","18","Used for continuous or numeric results or findings in standard format; copied in numeric format from MKSTRESC. MKSTRESN should store all numeric test results or findings.","Num","Result Qualifier","Perm","","",""
"1105","https://sdtm.d4k.dk/ig/MK/MKSTRESU","fc729003-62b7-4a68-9952-dd42ccffe2f9","Standard Units","MKSTRESU","19","Standardized units used for MKSTRESC and MKSTRESN.","Char","Variable Qualifier","Perm","","C71620","https://ct.d4k.dk/cdisc/dataset/sc/2018-12-21/sdtm/C71620"
"1106","https://sdtm.d4k.dk/ig/MK/MKSTAT","9b6eaa35-c4e4-4cbc-976f-63b8693a8e26","Completion Status","MKSTAT","20","Used to indicate that a question was not asked or a test was not done, or that a test was attempted but did not generate a result. Should be null if a result exists in MKORRES.","Char","Record Qualifier","Perm","","C66789","https://ct.d4k.dk/cdisc/dataset/sc/2018-12-21/send/C66789"
"1107","https://sdtm.d4k.dk/ig/MK/MKREASND","ed2ac9d0-dcda-434b-8da9-dff708e0f404","Reason Not Done","MKREASND","21","Reason not done. Used in conjunction with MKSTAT when value is ""NOT DONE"".","Char","Record Qualifier","Perm","","",""
"1108","https://sdtm.d4k.dk/ig/MK/MKLOC","30b1cd39-976b-4d8e-904c-4b0d4c044c09","Location Used for the Measurement","MKLOC","22","Anatomical location of the subject relevant to the collection of the measurement. Examples: ""INTERPHALANGEAL JOINT 1"", ""SHOULDER JOINT"".","Char","Record Qualifier","Exp","","C74456","https://ct.d4k.dk/cdisc/dataset/sc/2018-12-21/send/C74456"
"1109","https://sdtm.d4k.dk/ig/MK/MKLAT","c5d371ca-72dd-435d-9cc7-1a4505742ef1","Laterality","MKLAT","23","Qualifier for anatomical location or specimen further detailing laterality. Examples: ""RIGHT"", ""LEFT"", ""BILATERAL"".","Char","Variable Qualifier","Perm","","C99073","https://ct.d4k.dk/cdisc/dataset/sc/2018-12-21/send/C99073"
"1110","https://sdtm.d4k.dk/ig/MK/MKDIR","fa58bdb2-df9b-4297-92e5-a976e0793f0c","Directionality","MKDIR","24","Qualifier for anatomical location further detailing directionality. Examples: ""ANTERIOR"", ""LOWER"", ""PROXIMAL"".","Char","Variable Qualifier","Perm","","C99074","https://ct.d4k.dk/cdisc/dataset/sc/2018-12-21/send/C99074"
"1111","https://sdtm.d4k.dk/ig/MK/MKMETHOD","482658f6-dc90-4d1f-8d73-fc3f67339195","Method of Test or Examination","MKMETHOD","25","Method of the test or examination. Examples: ""X-RAY"", ""MRI"", ""CT SCAN"".","Char","Record Qualifier","Perm","","C85492","https://ct.d4k.dk/cdisc/dataset/sc/2019-03-29/sdtm/C85492"
"1112","https://sdtm.d4k.dk/ig/MK/MKLOBXFL","c1119e67-ed78-4e34-b1de-92677d8d5333","Last Observation Before Exposure Flag","MKLOBXFL","26","Operationally derived indicator used to identify the last non-missing value prior to RFXSTDTC. The value should be ""Y"" or null.","Char","Record Qualifier","Exp","","C66742","https://ct.d4k.dk/cdisc/dataset/sc/2018-12-21/send/C66742"
"1113","https://sdtm.d4k.dk/ig/MK/MKBLFL","de97c905-eb77-426c-a567-0644639b8db2","Baseline Flag","MKBLFL","27","Indicator used to identify a baseline value. Should be ""Y"" or null. Note that MKBLFL is retained for backward compatibility. The authoritative baseline for statistical analysis is in an ADaM dataset.","Char","Record Qualifier","Perm","","C66742","https://ct.d4k.dk/cdisc/dataset/sc/2018-12-21/send/C66742"
