"id:ID","uri","uuid","label","name","ordinal","description","data_type","role","core","value_domain","code_list","code_list_uri"
"1431","https://sdtm.d4k.dk/ig/RE/REORRES","0ddc8339-7bfa-4f0a-a9a6-afb449becf1b","Result or Finding in Original Units","REORRES","16","Result of the procedure measurement or finding as originally received or collected.","Char","Result Qualifier","Exp","","",""
"1432","https://sdtm.d4k.dk/ig/RE/REORRESU","2b28673a-6708-484b-8285-95732dbfd19d","Original Units","REORRESU","17","Original units in which the data were collected. The unit for REORRES and REORREF.","Char","Variable Qualifier","Perm","","C71620","https://ct.d4k.dk/cdisc/dataset/sc/2018-12-21/sdtm/C71620"
"1433","https://sdtm.d4k.dk/ig/RE/REORREF","d2cebaba-c3ab-414d-9294-2d7683db3746","Reference Result in Original Units","REORREF","18","Reference result for continuous measurements in original units. Should be collected only for continuous results.","Char","Variable Qualifier","Perm","","",""
"1434","https://sdtm.d4k.dk/ig/RE/RESTRESC","3107d3e6-e451-4dec-a40b-7cdead83d707","Character Result/Finding in Std Format","RESTRESC","19","Contains the result value for all findings, copied or derived from REORRES in a standard format or in standard units. RESTRESC should store all results or findings in character format; if results are numeric, they should also be stored in numeric format in RESTRESN.","Char","Result Qualifier","Exp","","",""
"1435","https://sdtm.d4k.dk/ig/RE/RESTRESN","a3499d19-2f8a-45da-b800-d0ddff7db3bf","Numeric Result/Finding in Standard Units","RESTRESN","20","Used for continuous or numeric results or findings in standard format; copied in numeric format from RESTRESC. RESTRESN should store all numeric test results or findings.","Num","Result Qualifier","Perm","","",""
"1436","https://sdtm.d4k.dk/ig/RE/RESTRESU","a8638d6a-bf45-4a49-ac45-6ee3f2b7f4c0","Standard Units","RESTRESU","21","Standardized unit used for RESTRESC, RESTRESN and RESTREFN.","Char","Variable Qualifier","Perm","","C71620","https://ct.d4k.dk/cdisc/dataset/sc/2018-12-21/sdtm/C71620"
"1437","https://sdtm.d4k.dk/ig/RE/RESTREFC","1e32b126-1d2b-4edb-bb65-825104aed4e7","Character Reference Result","RESTREFC","22","Reference value for the result or finding copied or derived from --ORREF in a standard format.","Char","Variable Qualifier","Perm","","",""
"1438","https://sdtm.d4k.dk/ig/RE/RESTREFN","c25d57bf-49d0-46d8-b8aa-7c9ca701bb86","Numeric Reference Result in Std Units","RESTREFN","23","Reference result for continuous measurements in standard units. Should be populated only for continuous results.","Num","Variable Qualifier","Perm","","",""
"1439","https://sdtm.d4k.dk/ig/RE/RESTAT","5a78327c-68d0-407b-94ff-038ab2c5ed02","Completion Status","RESTAT","24","Used to indicate that a test was not done or a measurement was not taken. Should be null if a result exists in REORRES.","Char","Record Qualifier","Perm","","C66789","https://ct.d4k.dk/cdisc/dataset/sc/2018-12-21/send/C66789"
"1440","https://sdtm.d4k.dk/ig/RE/REREASND","0c4117a9-b719-41e6-9d14-23e487f430d0","Reason Not Done","REREASND","25","Describes why a measurement or test was not performed. Examples: ""BROKEN EQUIPMENT"", ""SUBJECT REFUSED"". Used in conjunction with RESTAT when value is ""NOT DONE"".","Char","Record Qualifier","Perm","","",""
"1441","https://sdtm.d4k.dk/ig/RE/RELOC","bc878671-af34-400f-ab6a-988f5feab4ce","Location Used for the Measurement","RELOC","26","Anatomical location of the subject relevant to the collection of the measurement. Examples: ""LUNG"", ""BRONCHUS"".","Char","Record Qualifier","Perm","","C74456","https://ct.d4k.dk/cdisc/dataset/sc/2018-12-21/send/C74456"
"1442","https://sdtm.d4k.dk/ig/RE/RELAT","cd723649-44c4-4328-95de-75c01623c40f","Laterality","RELAT","27","Side of the body used to collect measurement. Examples: ""RIGHT"", ""LEFT"".","Char","Variable Qualifier","Perm","","C99073","https://ct.d4k.dk/cdisc/dataset/sc/2018-12-21/send/C99073"
"1443","https://sdtm.d4k.dk/ig/RE/REDIR","5ccf56e3-a7bd-4b0a-a31b-8ef82d62291e","Directionality","REDIR","28","Qualifier for anatomical location or specimen further detailing directionality. Examples: ""ANTERIOR"", ""LOWER"", ""PROXIMAL"".","Char","Variable Qualifier","Perm","","C99074","https://ct.d4k.dk/cdisc/dataset/sc/2018-12-21/send/C99074"
"1444","https://sdtm.d4k.dk/ig/RE/REMETHOD","ea484323-e993-4de1-96ce-42fe6be60f9b","Method of Test or Examination","REMETHOD","29","Method used to create the result.","Char","Record Qualifier","Perm","","C85492","https://ct.d4k.dk/cdisc/dataset/sc/2019-03-29/sdtm/C85492"
"1445","https://sdtm.d4k.dk/ig/RE/RELOBXFL","20ab42e7-297d-48e5-a0b0-e9898f4e9c0c","Last Observation Before Exposure Flag","RELOBXFL","30","Operationally-derived indicator used to identify the last non-missing value prior to RFXSTDTC. The value should be ""Y"" or null.","Char","Record Qualifier","Exp","","C66742","https://ct.d4k.dk/cdisc/dataset/sc/2018-12-21/send/C66742"
"1446","https://sdtm.d4k.dk/ig/RE/REBLFL","6d939713-0612-4d67-ad20-f3be9f4b1bcb","Baseline Flag","REBLFL","31","Indicator used to identify a baseline value. Should be Y or null. Note that REBLFL is retained for backward compatibility. The authoritative baseline flag for statistical analysis is in an ADaM dataset.","Char","Record Qualifier","Perm","","C66742","https://ct.d4k.dk/cdisc/dataset/sc/2018-12-21/send/C66742"
"1447","https://sdtm.d4k.dk/ig/RE/REDRVFL","1ad4f27d-bdc8-462c-a766-291f5e8cb7d8","Derived Flag","REDRVFL","32","Used to indicate a derived record. Should be ""Y"" or null. Records that represent the average of other records, or that do not come from the CRF, or are not as originally collected or received are examples of records that would be derived for the submission datasets. If REDRVFL = ""Y"", then REORRES could be null, with RESTRESC and (if numeric) RESTRESN having the derived value.","Char","Record Qualifier","Perm","","C66742","https://ct.d4k.dk/cdisc/dataset/sc/2018-12-21/send/C66742"
"1448","https://sdtm.d4k.dk/ig/RE/REEVAL","0d44f4f6-c3cf-4594-b73f-c5b4da66406d","Evaluator","REEVAL","33","Role of the person who provided the evaluation. Used only for results that are subjective (e.g., assigned by a person or a group). Examples: ""ADJUDICATION COMMITTEE"", ""INDEPENDENT ASSESSOR"", ""RADIOLOGIST"".","Char","Record Qualifier","Perm","","C78735","https://ct.d4k.dk/cdisc/dataset/sc/2019-03-29/sdtm/C78735"
"1449","https://sdtm.d4k.dk/ig/RE/REEVALID","03cf45d8-8ca7-479d-9439-3d6dba9318e4","Evaluator Identifier","REEVALID","34","Used to distinguish multiple evaluators with the same role recorded in REEVAL. Examples: ""RADIOLOGIST1"", ""RADIOLOGIST2"".","Char","Variable Qualifier","Perm","","C96777","https://ct.d4k.dk/cdisc/dataset/sc/2019-03-29/sdtm/C96777"
"1450","https://sdtm.d4k.dk/ig/RE/REREPNUM","205443a4-8df1-45bf-b21f-8e678e6565c4","Repetition Number","REREPNUM","35","The instance number of a test that is repeated within a given time frame for the same test. The level of granularity can vary (e.g., within a time point, within a visit). Example: multiple measurements of pulmonary function.","Num","Record Qualifier","Perm","","",""
"1451","https://sdtm.d4k.dk/ig/RE/VISITNUM","b333ac7e-375a-4b77-91f8-492b41cab81f","Visit Number","VISITNUM","36","Clinical encounter number. Numeric version of VISIT, used for sorting.","Num","Timing","Exp","","",""
"1452","https://sdtm.d4k.dk/ig/RE/VISIT","473e4a55-7c2b-4e2c-98b4-84adaa5d2196","Visit Name","VISIT","37","Protocol-defined description of a clinical encounter. May be used in addition to VISITNUM and/or VISITDY.","Char","Timing","Perm","","",""
"1453","https://sdtm.d4k.dk/ig/RE/VISITDY","e78db2af-da44-40e0-a51a-2f2ec5ebb11f","Planned Study Day of Visit","VISITDY","38","Planned study day of the visit based upon RFSTDTC in Demographics.","Num","Timing","Perm","","",""
"1454","https://sdtm.d4k.dk/ig/RE/TAETORD","b574148d-080d-4b64-b081-3ef23a3c6197","Planned Order of Element within Arm","TAETORD","39","Number that gives the planned order of the element within the arm for the element in which the assessment was made.","Num","Timing","Perm","","",""
"1455","https://sdtm.d4k.dk/ig/RE/EPOCH","216675fd-8065-4d9b-842b-edaac4176b37","Epoch","EPOCH","40","Epoch associated with the date/time at which the assessment was made.","Char","Timing","Perm","","C99079","https://ct.d4k.dk/cdisc/dataset/sc/2019-03-29/sdtm/C99079"
"1456","https://sdtm.d4k.dk/ig/RE/REDTC","709cbc9e-b91d-40f8-beb5-5a5c23d38647","Date/Time of Collection","REDTC","41","Date/time of procedure or test.","Char","Timing","Exp","ISO 8601 datetime or interval","",""
"1457","https://sdtm.d4k.dk/ig/RE/REDY","97d31415-3a52-414c-8fe4-414ecfb3671f","Study Day of Visit/Collection/Exam","REDY","42","Actual study day of visit/collection/exam expressed in integer days relative to the sponsor-defined RFSTDTC in Demographics.","Num","Timing","Perm","","",""
"1458","https://sdtm.d4k.dk/ig/RE/RETPT","855dd981-c6a3-4276-8689-caaa0b3e16da","Planned Time Point Name","RETPT","43","Text description of time when a measurement or observation should be taken as defined in the protocol. This may be represented as an elapsed time relative to a fixed reference point (e.g., ""TIME OF LAST DOSE""). See RETPTNUM and RETPTREF. Examples: ""START"", ""5 MINUTES POST"".","Char","Timing","Perm","","",""
"1459","https://sdtm.d4k.dk/ig/RE/RETPTNUM","a0a14992-8f2e-447f-8c94-f590e4bc033f","Planned Time Point Number","RETPTNUM","44","Numeric version of RETPT to aid in sorting.","Num","Timing","Perm","","",""
"1460","https://sdtm.d4k.dk/ig/RE/REELTM","e3cfc3d1-80be-45de-b2fb-d2fb6734bf5f","Planned Elapsed Time from Time Point Ref","REELTM","45","Planned elapsed time relative to a planned fixed reference (RETPTREF). Not a clock time or a date/time variable, but an interval, represented as ISO duration. Examples: ""-PT15M"" to represent 15 minutes prior to the reference time point indicated by RETPTREF, ""PT8H"" to represent 8 hours after the reference time point represented by RETPTREF.","Char","Timing","Perm","ISO 8601 duration","",""
"1461","https://sdtm.d4k.dk/ig/RE/RETPTREF","9e707671-a28c-42b3-8723-49b9a651795b","Time Point Reference","RETPTREF","46","Description of the fixed reference point referred to by REELTM, RETPTNUM, and RETPT. Examples: ""PREVIOUS DOSE"", ""PREVIOUS MEAL"".","Char","Timing","Perm","","",""
"1462","https://sdtm.d4k.dk/ig/RE/RERFTDTC","869f2173-936c-4fc7-8e81-c14db3081de7","Date/Time of Reference Time Point","RERFTDTC","47","Date/time for a fixed reference time point defined by RETPTREF.","Char","Timing","Perm","ISO 8601 datetime or interval","",""
"1463","https://sdtm.d4k.dk/ig/RP/STUDYID","64106acd-8021-4e17-a23d-7c3282d26702","Study Identifier","STUDYID","1","Unique identifier for a study.","Char","Identifier","Req","","",""
"1464","https://sdtm.d4k.dk/ig/RP/DOMAIN","30cb6bcd-90c7-415a-bdcc-d6b4898b5265","Domain Abbreviation","DOMAIN","2","Two-character abbreviation for the domain.","Char","Identifier","Req","","",""
"1465","https://sdtm.d4k.dk/ig/RP/USUBJID","236a8d25-466e-4c87-98a5-2511e9050849","Unique Subject Identifier","USUBJID","3","Identifier used to uniquely identify a subject across all studies for all applications or submissions involving the product.","Char","Identifier","Req","","",""
"1466","https://sdtm.d4k.dk/ig/RP/RPSEQ","122acf74-82aa-46a3-b3e7-505cc9731826","Sequence Number","RPSEQ","4","Sequence number to ensure uniqueness of records within a dataset for a subject (or within a parameter, in the case of the Trial Summary domain). May be any valid number (including decimals) and does not have to start at 1.","Num","Identifier","Req","","",""
"1467","https://sdtm.d4k.dk/ig/RP/RPGRPID","b2f7dc4a-f42c-40be-87f7-b8fc9d691a50","Group ID","RPGRPID","5","Optional group identifier, used to link together a block of related records within a subject in a domain. Also used to link together a block of related records in the Trial Summary dataset.","Char","Identifier","Perm","","",""
"1468","https://sdtm.d4k.dk/ig/RP/RPREFID","87272775-8b19-461e-8a7e-03fb4c8a6783","Reference ID","RPREFID","6","Optional internal or external identifier (e.g., lab specimen ID, UUID for an ECG waveform or a medical image).","Char","Identifier","Perm","","",""
"1469","https://sdtm.d4k.dk/ig/RP/RPSPID","b86af26f-6567-4e74-ac34-eaf90f80737c","Sponsor-Defined Identifier","RPSPID","7","Sponsor-defined identifier. Example: Preprinted line identifier on a CRF.","Char","Identifier","Perm","","",""
"1470","https://sdtm.d4k.dk/ig/RP/RPLNKID","07e91bc3-0cd4-4b8b-bf69-fcd6d1ae4b99","Link ID","RPLNKID","8","Identifier used to link related records across domains. This may be a one-to-one or a one-to-many relationship.","Char","Identifier","Perm","","",""
"1471","https://sdtm.d4k.dk/ig/RP/RPLNKGRP","af64e648-2491-4713-a31e-e26b989e2a57","Link Group ID","RPLNKGRP","9","Identifier used to link related records across domains. This will usually be a many-to-one relationship.","Char","Identifier","Perm","","",""
"1472","https://sdtm.d4k.dk/ig/RP/RPTESTCD","2fd77d26-d0f1-44c1-a1d2-84172d5244f6","Short Name of Reproductive Test","RPTESTCD","10","Short character value for RPTEST used as a column name when converting a dataset from a vertical format to a horizontal format. The short value can be up to 8 characters. Examples: ""CHILDPOT"", ""BCMETHOD"", ""MENARAGE"".","Char","Topic","Req","","C106479","https://ct.d4k.dk/cdisc/dataset/sc/2019-03-29/sdtm/C106479"
"1473","https://sdtm.d4k.dk/ig/RP/RPTEST","ffdabc8b-3743-472d-9ad1-03ecfc333e02","Name of Reproductive Test","RPTEST","11","Long name For RPTESTCD. Examples: ""Childbearing Potential"", ""Birth Control Method"", ""Menarche Age"".","Char","Synonym Qualifier","Req","","C106478","https://ct.d4k.dk/cdisc/dataset/sc/2019-03-29/sdtm/C106478"
"1474","https://sdtm.d4k.dk/ig/RP/RPCAT","20ca99a2-e915-4916-b44b-b0e8ae35372e","Category for Reproductive Test","RPCAT","12","Used to define a category of topic-variable values. Example: ""No use case to date, but values would be relative to reproduction tests grouping"".","Char","Grouping Qualifier","Perm","","",""
"1475","https://sdtm.d4k.dk/ig/RP/RPSCAT","763acb56-cf21-4bb5-b3aa-b7d1af38f571","Subcategory for Reproductive Test","RPSCAT","13","Used to define a further categorization of RPCAT values. Example: ""No use case to date, but values would be relative to reproduction tests grouping"".","Char","Grouping Qualifier","Perm","","",""
"1476","https://sdtm.d4k.dk/ig/RP/RPORRES","2c4af10c-f262-4904-9259-2ebda6ae458e","Result or Finding in Original Units","RPORRES","14","Result of the measurement or finding as originally received or collected. Examples: ""120"", ""<1"", ""POS"".","Char","Result Qualifier","Exp","","",""
"1477","https://sdtm.d4k.dk/ig/RP/RPORRESU","8151d176-740e-40e7-b2c1-6b8192365563","Original Units","RPORRESU","15","Unit for RPORRES. Examples: ""in"", ""LB"", ""kg/L"".","Char","Variable Qualifier","Perm","","C71620","https://ct.d4k.dk/cdisc/dataset/sc/2018-12-21/sdtm/C71620"
"1478","https://sdtm.d4k.dk/ig/RP/RPSTRESC","a9176a68-8a43-4699-8c73-94809fb73112","Character Result/Finding in Std Format","RPSTRESC","16","Contains the result value for all findings copied or derived from RPORRES, in a standard format or in standard units. RPSTRESC should store all results or findings in character format; if results are numeric, they should also be stored in numeric format in RPSTRESN. For example, if various tests have results ""NONE"", ""NEG"", and ""NEGATIVE"" in RPORRES, and these results effectively have the same meaning, they could be represented in standard format in RPSTRESC as ""NEGATIVE"".","Char","Result Qualifier","Exp","","",""
"1479","https://sdtm.d4k.dk/ig/RP/RPSTRESN","38e46c12-e8c9-494c-b063-15a57b292812","Numeric Result/Finding in Standard Units","RPSTRESN","17","Used for continuous or numeric results or findings in standard format; copied in numeric format from RPSTRESC. RPSTRESN should store all numeric test results or findings.","Num","Result Qualifier","Perm","","",""
"1480","https://sdtm.d4k.dk/ig/RP/RPSTRESU","44bcbbe9-c9f3-4ae3-b4be-ed78caf5bf41","Standard Units","RPSTRESU","18","Standardized units used for RPSTRESC and RPSTRESN. Example: ""mol/L"".","Char","Variable Qualifier","Perm","","C71620","https://ct.d4k.dk/cdisc/dataset/sc/2018-12-21/sdtm/C71620"
"1481","https://sdtm.d4k.dk/ig/RP/RPSTAT","a0fc9ab4-3b1e-42ae-925c-ec9fb5315808","Completion Status","RPSTAT","19","Used to indicate that a question was not asked or a test was not done, or a test was attempted but did not generate a result. Should be null or have a value of ""NOT DONE"".","Char","Record Qualifier","Perm","","C66789","https://ct.d4k.dk/cdisc/dataset/sc/2018-12-21/send/C66789"
"1482","https://sdtm.d4k.dk/ig/RP/RPREASND","8fe954dd-c7f5-4ddd-ada9-5a005a3ba707","Reason Not Done","RPREASND","20","Reason not done. Used in conjunction with RPSTAT when value is ""NOT DONE"".","Char","Record Qualifier","Perm","","",""
"1483","https://sdtm.d4k.dk/ig/RP/RPLOBXFL","ce3f83b9-f576-43bc-91c6-cf94401ce048","Last Observation Before Exposure Flag","RPLOBXFL","21","Operationally derived indicator used to identify the last non-missing value prior to RFXSTDTC. The value should be ""Y"" or null.","Char","Record Qualifier","Perm","","C66742","https://ct.d4k.dk/cdisc/dataset/sc/2018-12-21/send/C66742"
"1484","https://sdtm.d4k.dk/ig/RP/RPBLFL","f5bc8b82-904c-4900-9fa0-9964f66df666","Baseline Flag","RPBLFL","22","Indicator used to identify a baseline value. Should be ""Y"" or null. Note that RPBLFL is retained for backward compatibility. The authoritative baseline for statistical analysis is in an ADaM dataset.","Char","Record Qualifier","Perm","","C66742","https://ct.d4k.dk/cdisc/dataset/sc/2018-12-21/send/C66742"
"1485","https://sdtm.d4k.dk/ig/RP/RPDRVFL","f79aef63-ecaa-4453-b294-5d57245998fd","Derived Flag","RPDRVFL","23","Used to indicate a derived record. The value should be ""Y"" or null. Records which represent the average of other records or which do not come from the CRF are examples of records that would be derived for the submission datasets. If RPDRVFL = ""Y"", then RPORRES may be null, with RPSTRESC and (if numeric) RPSTRESN having the derived value.","Char","Record Qualifier","Perm","","C66742","https://ct.d4k.dk/cdisc/dataset/sc/2018-12-21/send/C66742"
"1486","https://sdtm.d4k.dk/ig/RP/VISITNUM","71034c38-53a6-4f4e-a597-082b80398d0c","Visit Number","VISITNUM","24","Clinical encounter number. Numeric version of VISIT, used for sorting.","Num","Timing","Exp","","",""
"1487","https://sdtm.d4k.dk/ig/RP/VISIT","3d7460d1-9b99-4750-a3f0-3f3f6f4ea3ac","Visit Name","VISIT","25","Protocol-defined description of a clinical encounter.","Char","Timing","Perm","","",""
"1488","https://sdtm.d4k.dk/ig/RP/VISITDY","0abe80c1-3bde-409f-9d74-555f8cd1dd2b","Planned Study Day of Visit","VISITDY","26","Planned study day of VISIT. Should be an integer.","Num","Timing","Perm","","",""
"1489","https://sdtm.d4k.dk/ig/RP/TAETORD","4cb20b5c-512b-4845-8abd-9e3deb0d5210","Planned Order of Element within Arm","TAETORD","27","Number that gives the planned order of the element within the arm for the element in which the assessment was made.","Num","Timing","Perm","","",""
"1490","https://sdtm.d4k.dk/ig/RP/EPOCH","6e737871-20c1-481b-8bc5-745db70c5e50","Epoch","EPOCH","28","Epoch associated with the date/time at which the assessment was made.","Char","Timing","Perm","","C99079","https://ct.d4k.dk/cdisc/dataset/sc/2019-03-29/sdtm/C99079"
"1491","https://sdtm.d4k.dk/ig/RP/RPDTC","aa014b6d-6bd6-4f03-9f8d-c62dbb1928af","Date/Time of Collection","RPDTC","29","Collection date and time of an observation.","Char","Timing","Exp","ISO 8601 datetime or interval","",""
"1492","https://sdtm.d4k.dk/ig/RP/RPDY","a7b62bc3-68d1-497e-812b-ddf70c8d934a","Study Day of Visit/Collection/Exam","RPDY","30","Actual study day of visit/collection/exam expressed in integer days relative to the sponsor-defined RFSTDTC in Demographics.","Num","Timing","Perm","","",""
"1493","https://sdtm.d4k.dk/ig/RP/RPDUR","ae423c58-4351-4a44-8e59-fb9aff3321e4","Duration","RPDUR","31","Collected duration of an event, intervention, or finding represented in ISO 8601 character format. Used only if collected on the CRF and not derived.","Char","Timing","Perm","ISO 8601 duration","",""
"1494","https://sdtm.d4k.dk/ig/RP/RPTPT","bd9a091a-f7f9-4fff-b3a2-9b99d1b03c68","Planned Time Point Name","RPTPT","32","Text description of time when a measurement or observation should be taken as defined in the protocol. This may be represented as an elapsed time relative to a fixed reference point, such as time of last dose.","Char","Timing","Perm","","",""
"1495","https://sdtm.d4k.dk/ig/RP/RPTPTNUM","d1b10abc-82fd-45b2-9a7c-4f3f9cc3156d","Planned Time Point Number","RPTPTNUM","33","Numeric version of planned time point used in sorting.","Num","Timing","Perm","","",""
"1496","https://sdtm.d4k.dk/ig/RP/RPELTM","a7edb2d5-989f-49f5-af78-42ad016bf405","Planned Elapsed Time from Time Point Ref","RPELTM","34","Planned elapsed time in ISO 8601 character format relative to a planned fixed reference (RPTPTREF; e.g., ""PREVIOUS DOSE"", ""PREVIOUS MEAL""). This variable is useful where there are repetitive measures. Not a clock time or a date/time variable, but an interval, represented as ISO duration.","Char","Timing","Perm","ISO 8601 duration","",""
"1497","https://sdtm.d4k.dk/ig/RP/RPTPTREF","872b2f34-fc25-4e4a-a0ce-17e13bec6d93","Time Point Reference","RPTPTREF","35","Description of the fixed reference point referred to by RPELTM, RPTPTNUM, and RPTPT. Examples: ""PREVIOUS DOSE"", ""PREVIOUS MEAL"".","Char","Timing","Perm","","",""
"1498","https://sdtm.d4k.dk/ig/RP/RPRFTDTC","ec5d43da-72ef-4c87-a310-27dd4f76f707","Date/Time of Reference Time Point","RPRFTDTC","36","Date/time for a fixed reference time point defined by RPTPTREF in ISO 8601 character format.","Char","Timing","Perm","ISO 8601 datetime or interval","",""
"1499","https://sdtm.d4k.dk/ig/RS/STUDYID","8cac9878-c6eb-4525-a3b5-42fd83e05a47","Study Identifier","STUDYID","1","Unique identifier for a study.","Char","Identifier","Req","","",""
"1500","https://sdtm.d4k.dk/ig/RS/DOMAIN","2901b647-0ec9-4d1e-9f1d-ad71e7653f96","Domain Abbreviation","DOMAIN","2","Two-character abbreviation for the domain.","Char","Identifier","Req","","",""
"1501","https://sdtm.d4k.dk/ig/RS/USUBJID","a185335a-b5ce-4579-8bee-60c5a7aaee85","Unique Subject Identifier","USUBJID","3","Identifier used to uniquely identify a subject across all studies for all applications or submissions involving the product.","Char","Identifier","Req","","",""
"1502","https://sdtm.d4k.dk/ig/RS/RSSEQ","b7e4262a-2e37-41d2-b807-d3337cde6b28","Sequence Number","RSSEQ","4","Sequence number given to ensure uniqueness within a dataset for a subject. May be any valid number.","Num","Identifier","Req","","",""
"1503","https://sdtm.d4k.dk/ig/RS/RSGRPID","8fcc92fc-5933-40c0-af4e-b06626469a12","Group ID","RSGRPID","5","Used to link together a block of related records within a subject in a domain.","Char","Identifier","Perm","","",""
"1504","https://sdtm.d4k.dk/ig/RS/RSREFID","0e7e1f39-845e-4acb-aa81-6d6308c1279e","Reference ID","RSREFID","6","Internal or external identifier.","Char","Identifier","Perm","","",""
"1505","https://sdtm.d4k.dk/ig/RS/RSSPID","e910b9a2-73ae-4202-9c23-485fbc57eff5","Sponsor-Defined Identifier","RSSPID","7","Sponsor-defined identifier.","Char","Identifier","Perm","","",""
"1506","https://sdtm.d4k.dk/ig/RS/RSLNKID","d26ac57e-f7af-4913-bc16-0ba699798ed8","Link ID","RSLNKID","8","An identifier used to link the response assessment to the related measurement record in another domain which was used to determine the response result. LNKID values group records within USUBJID.","Char","Identifier","Perm","","",""
"1507","https://sdtm.d4k.dk/ig/RS/RSLNKGRP","89db67fa-3a08-41f0-9e45-4c2331ae249e","Link Group ID","RSLNKGRP","9","A grouping identifier used to link the response assessment to a group of measurement/assessment records which were used in the assessment of the response. LNKGRP values group records within USUBJID.","Char","Identifier","Perm","","",""
"1508","https://sdtm.d4k.dk/ig/RS/RSTESTCD","b342b3ac-2fda-48e4-a105-109dc796d48c","Assessment Short Name","RSTESTCD","10","Short name of the TEST in RSTEST. The value in RSTESTCD cannot be longer than 8 characters, nor can it start with a number (e.g., ""1TEST"" is not valid). RSTESTCD cannot contain characters other than letters, numbers, or underscores. Examples: ""TRGRESP"", ""NTRGRESP"", ""OVRLRESP"", ""SYMPTDTR"", ""CPS0102"". \n There are separate codelists used for RSTESTCD where the choice depends on the value of RSCAT. Codelist ""ONCRTSCD"" is used for oncology response criteria (when RSCAT is a term in codelist ""ONCRSCAT""). Examples: TRGRESP, ""NTRGRESP, ""OVRLRESP"". For Clinical Classifications (when RSCAT is a term in codelist ""CCCAT""), QRS Naming Rules apply. These instruments have individual dedicated terminology codelists.","Char","Topic","Req","","C96782","https://ct.d4k.dk/cdisc/dataset/sc/2019-03-29/sdtm/C96782"
"1509","https://sdtm.d4k.dk/ig/RS/RSTEST","ef4bd427-9e0f-479a-9f06-4a067525451a","Assessment Name","RSTEST","11","Verbatim name of the response assessment. The value in RSTEST cannot be longer than 40 characters. \n There are separate codelists used for RSTEST where the choice depends on the value of RSCAT. Codelist ""ONCRTS"" is used for oncology response criteria (when RSCAT is a term in codelist ""ONCRSCAT""). Examples: ""Target Response"", ""Non-target Response"", ""Overall Response"", ""Symptomatic Deterioration"". For Clinical Classifications (when RSCAT is a term in codelist ""CCCAT""), QRS Naming Rules apply. These instruments have individual dedicated terminology codelists.","Char","Synonym Qualifier","Req","","C96781","https://ct.d4k.dk/cdisc/dataset/sc/2019-03-29/sdtm/C96781"
