"id:ID","uri","uuid","label","name","structure","ordinal","description"
"2","https://sdtm.d4k.dk/ig/AG","795a1a38-1fe9-4e4a-99d8-c697264da6fc","Procedure Agents","AG","One record per recorded intervention occurrence per subject","2","Procedure Agents"
"3","https://sdtm.d4k.dk/ig/CM","da44815b-a617-4678-8380-994342d3fc3f","Concomitant/Prior Medications","CM","One record per recorded intervention occurrence or constant-dosing interval per subject","6","Concomitant/Prior Medications"
"4","https://sdtm.d4k.dk/ig/EC","a38ad715-279b-43d0-9226-7d7fecc4c615","Exposure as Collected","EC","One record per protocol-specified study treatment, collected-dosing interval, per subject, per mood","15","Exposure as Collected"
"5","https://sdtm.d4k.dk/ig/EX","7fa87c1e-f911-442d-81f3-275a6ab6e15a","Exposure","EX","One record per protocol-specified study treatment, constant-dosing interval, per subject","17","Exposure"
"6","https://sdtm.d4k.dk/ig/ML","9a5431bd-1abb-41cf-b74b-ab6f9a6a949e","Meal Data","ML","One record per food product occurrence or constant intake interval per subject","29","Meal Data"
"7","https://sdtm.d4k.dk/ig/PR","1da6d945-d421-44a5-b337-bb5e5e4fe37b","Procedures","PR","One record per recorded procedure per occurrence per subject","37","Procedures"
"8","https://sdtm.d4k.dk/ig/SU","ffba21f3-3f4a-42cf-b74c-904120d3fd87","Substance Use","SU","One record per substance type per reported occurrence per subject","50","Substance Use"
"9","https://sdtm.d4k.dk/ig/AE","9c89505b-2e05-442d-be11-944f353b9541","Adverse Events","AE","One record per adverse event per subject","1","Adverse Events"
"10","https://sdtm.d4k.dk/ig/BE","e2eddd52-722a-4b9b-a22f-155a35976990","Biospecimen Events","BE","One record per instance per biospecimen event per biospecimen identifier per subject","3","Biospecimen Events"
"11","https://sdtm.d4k.dk/ig/CE","5f4148ad-21d5-43c6-b282-bfa336c64f47","Clinical Events","CE","One record per event per subject","5","Clinical Events"
"12","https://sdtm.d4k.dk/ig/DS","7fd3f109-b63a-48aa-a6d6-bd1e5c4bddde","Disposition","DS","One record per disposition status or protocol milestone per subject","13","Disposition"
"13","https://sdtm.d4k.dk/ig/DV","925670e1-2085-4343-aecd-e44e9b2bc4b1","Protocol Deviations","DV","One record per protocol deviation per subject","14","Protocol Deviations"
"14","https://sdtm.d4k.dk/ig/HO","20c62433-a265-4c74-af77-951962c80a19","Healthcare Encounters","HO","One record per healthcare encounter per subject","21","Healthcare Encounters"
"15","https://sdtm.d4k.dk/ig/MH","6dd09d64-4bbd-4eaf-a888-8a839bba0a69","Medical History","MH","One record per medical history event per subject","26","Medical History"
"16","https://sdtm.d4k.dk/ig/BS","a9c157bc-fd11-4d49-98df-7510a2e56e18","Biospecimen Findings","BS","One record per measurement per biospecimen identifier per subject","4","Biospecimen Findings"
"17","https://sdtm.d4k.dk/ig/CP","a2f1873a-f98f-4e23-9f79-9f78fb777902","Cell Phenotype Findings","CP","One record per test per specimen per timepoint per visit per subject","8","Cell Phenotype Findings"
"18","https://sdtm.d4k.dk/ig/CV","cf9159cf-4ff6-459d-b2e8-5ca050519cec","Cardiovascular System Findings","CV","One record per finding or result per time point per visit per subject","9","Cardiovascular System Findings"
"19","https://sdtm.d4k.dk/ig/DA","26fe0157-498a-4315-a25e-23a4a6e80b07","Product Accountability","DA","One record per product accountability finding per subject","10","Product Accountability"
"20","https://sdtm.d4k.dk/ig/DD","16b81c38-2738-45b8-a629-5cdbef3c1eb6","Death Details","DD","One record per finding per subject","11","Death Details"
"21","https://sdtm.d4k.dk/ig/EG","358a4b60-f558-4ee4-9152-9743b4886a22","ECG Test Results","EG","One record per ECG observation per replicate per time point or one record per ECG observation per beat per visit per subject","16","ECG Test Results"
"22","https://sdtm.d4k.dk/ig/FT","cf8fec68-91c4-4b84-838f-deb97f731aa2","Functional Tests","FT","One record per Functional Test finding per time point per visit per subject","19","Functional Tests"
"23","https://sdtm.d4k.dk/ig/GF","ee3488f7-bb76-46a3-ad21-b70f33ce1719","Genomics Findings","GF","One record per finding per observation per biospecimen per subject","20","Genomics Findings"
"24","https://sdtm.d4k.dk/ig/IE","23b8a7dd-a844-45e4-8d25-59e3f3a71402","Inclusion/Exclusion Criteria Not Met","IE","One record per inclusion/exclusion criterion not met per subject","22","Inclusion/Exclusion Criteria Not Met"
"25","https://sdtm.d4k.dk/ig/IS","fb66aae6-7f17-4eea-af7f-72ee445763ab","Immunogenicity Specimen Assessments","IS","One record per test per visit per subject","23","Immunogenicity Specimen Assessments"
"26","https://sdtm.d4k.dk/ig/LB","897d1c20-1796-4b7b-aadc-d4195ae1c2e4","Laboratory Test Results","LB","One record per lab test per time point per visit per subject","24","Laboratory Test Results"
"27","https://sdtm.d4k.dk/ig/MB","c8cad54a-f7f3-4df7-93e8-bf34ad6a1a33","Microbiology Specimen","MB","One record per microbiology specimen finding per time point per visit per subject","25","Microbiology Specimen"
"28","https://sdtm.d4k.dk/ig/MI","ee98b908-a49c-422b-bf34-7791ce7d14ab","Microscopic Findings","MI","One record per finding per specimen per subject","27","Microscopic Findings"
"29","https://sdtm.d4k.dk/ig/MK","89a0bd8b-5385-43bf-a718-f4582c68fcfa","Musculoskeletal System Findings","MK","One record per assessment per visit per subject","28","Musculoskeletal System Findings"
"30","https://sdtm.d4k.dk/ig/MS","bfbbecb6-df01-45e8-8f0d-2458ce0bf560","Microbiology Susceptibility","MS","One record per microbiology susceptibility test (or other organism-related finding) per organism found in MB","30","Microbiology Susceptibility"
"31","https://sdtm.d4k.dk/ig/NV","f5ca6ade-ee65-49d2-86c1-e2a7dbafb7d6","Nervous System Findings","NV","One record per finding per location per time point per visit per subject","31","Nervous System Findings"
"32","https://sdtm.d4k.dk/ig/OE","a37aae79-d4d1-4d81-93b0-307cbacf062d","Ophthalmic Examinations","OE","One record per ophthalmic finding per method per location, per time point per visit per subject","32","Ophthalmic Examinations"
"33","https://sdtm.d4k.dk/ig/PC","98fa57c2-5300-4acb-b84c-1a63a92c4d57","Pharmacokinetics Concentrations","PC","One record per sample characteristic or time-point concentration per reference time point or per analyte per subject","34","Pharmacokinetics Concentrations"
"34","https://sdtm.d4k.dk/ig/PE","6f1243dd-a29f-4a21-b548-e680d1702588","Physical Examination","PE","One record per body system or abnormality per visit per subject","35","Physical Examination"
"35","https://sdtm.d4k.dk/ig/PP","66305bc2-abc8-4f29-b35b-ee41c986203d","Pharmacokinetics Parameters","PP","One record per PK parameter per time-concentration profile per modeling method per subject","36","Pharmacokinetics Parameters"
"36","https://sdtm.d4k.dk/ig/QS","e5148b0c-3940-4683-bec7-cc52dcef07b9","Questionnaires","QS","One record per questionnaire per question per time point per visit per subject","38","Questionnaires"
"37","https://sdtm.d4k.dk/ig/RE","9edc0bfa-c793-4b14-a95c-db7bb946992e","Respiratory System Findings","RE","One record per finding or result per time point per visit per subject","39","Respiratory System Findings"
"38","https://sdtm.d4k.dk/ig/RP","1166d0e8-62e2-4fc0-9e4e-bafff629820a","Reproductive System Findings","RP","One record per finding or result per time point per visit per subject","43","Reproductive System Findings"
"39","https://sdtm.d4k.dk/ig/RS","1b5d5731-8c4f-48d4-ae79-58e5db2272f2","Disease Response and Clin Classification","RS","One record per response assessment or clinical classification assessment per time point per visit per subject per assessor per medical evaluator","44","Disease Response and Clin Classification"
"40","https://sdtm.d4k.dk/ig/SC","15c70fc2-19c2-40bc-b85b-8d098efe13d5","Subject Characteristics","SC","One record per characteristic per visit per subject.","45","Subject Characteristics"
"41","https://sdtm.d4k.dk/ig/SS","ad45dec3-89f7-4513-b0f7-f627e90a2654","Subject Status","SS","One record per status per visit per subject","49","Subject Status"
"42","https://sdtm.d4k.dk/ig/TR","87a06261-6f3c-444d-a9f3-5f1892cd34d3","Tumor/Lesion Results","TR","One record per tumor measurement/assessment per visit per subject per assessor","58","Tumor/Lesion Results"
"43","https://sdtm.d4k.dk/ig/TU","8c33c527-547b-4883-a29d-9b85adeb97a8","Tumor/Lesion Identification","TU","One record per identified tumor per subject per assessor","60","Tumor/Lesion Identification"
"44","https://sdtm.d4k.dk/ig/UR","b7303c2a-138b-4b1c-8093-759c0c3d575d","Urinary System Findings","UR","One record per finding per location per per visit per subject","62","Urinary System Findings"
"45","https://sdtm.d4k.dk/ig/VS","51ba62bf-6d6d-4adb-9f51-d63b89ddaee8","Vital Signs","VS","One record per vital sign measurement per time point per visit per subject","63","Vital Signs"
"46","https://sdtm.d4k.dk/ig/FA","dadfcc8f-1069-49b1-923b-fb5815041bee","Findings About Events or Interventions","FA","One record per finding, per object, per time point, per visit per subject","18","Findings About Events or Interventions"
"47","https://sdtm.d4k.dk/ig/SR","cfc8fae4-5bd6-4c64-b9d9-423f710c7513","Skin Response","SR","One record per finding, per object, per time point, per visit per subject","48","Skin Response"
"48","https://sdtm.d4k.dk/ig/CO","63dc2a6f-2742-4344-978b-fe2bf724b29d","Comments","CO","One record per comment per subject","7","Comments"
"49","https://sdtm.d4k.dk/ig/DM","cf3bd2a9-2ef1-48c2-b93e-73b3dea875f6","Demographics","DM","One record per subject","12","Demographics"
"50","https://sdtm.d4k.dk/ig/SE","aa800902-891a-4ea7-bfe5-90c8efa5246d","Subject Elements","SE","One record per actual Element per subject","46","Subject Elements"
"51","https://sdtm.d4k.dk/ig/SM","5066978b-27cf-45a5-ab69-aa7e983fe581","Subject Disease Milestones","SM","One record per Disease Milestone per subject","47","Subject Disease Milestones"
"52","https://sdtm.d4k.dk/ig/SV","0ccf8f35-e6cb-4271-9826-3df770997d00","Subject Visits","SV","One record per actual or planned visit per subject","52","Subject Visits"
"53","https://sdtm.d4k.dk/ig/TA","947990c9-656d-47e4-86e4-2c3c339f8999","Trial Arms","TA","One record per planned Element per Arm","53","Trial Arms"
"54","https://sdtm.d4k.dk/ig/TD","299bb9d8-bae2-42d4-a2db-f8e3a9299840","Trial Disease Assessments","TD","One record per planned constant assessment period","54","Trial Disease Assessments"
"55","https://sdtm.d4k.dk/ig/TE","b2b60edb-f0a9-4d93-93ce-49338f130ecb","Trial Elements","TE","One record per planned Element","55","Trial Elements"
"56","https://sdtm.d4k.dk/ig/TI","129864e8-8d39-4a98-98ce-b0dc2050a2bd","Trial Inclusion/Exclusion Criteria","TI","One record per I/E criterion","56","Trial Inclusion/Exclusion Criteria"
"57","https://sdtm.d4k.dk/ig/TM","0d7e8933-db33-4961-b75d-2c373bb313d9","Trial Disease Milestones","TM","One record per Disease Milestone type","57","Trial Disease Milestones"
"58","https://sdtm.d4k.dk/ig/TS","5b4d7a69-ae80-4f1b-aa2c-770fb07b4989","Trial Summary","TS","One record per trial summary parameter value","59","Trial Summary"
"59","https://sdtm.d4k.dk/ig/TV","e056b330-ed7b-48c7-b1dc-837548ea9ae9","Trial Visits","TV","One record per planned Visit per Arm","61","Trial Visits"
"60","https://sdtm.d4k.dk/ig/OI","aa32b5a0-2166-44c8-af2c-f2487b7412f0","Non-host Organism Identifiers","OI","One record per taxon per non-host organism","33","Non-host Organism Identifiers"
"61","https://sdtm.d4k.dk/ig/RELREC","15d1020b-8638-44df-98de-097097de3e83","Related Records","RELREC","One record per related record, group of records or dataset","40","Related Records"
"62","https://sdtm.d4k.dk/ig/RELSPEC","1d45776b-7ded-414f-8055-6e1ac739d867","Related Specimens","RELSPEC","One record per specimen identifier per subject","41","Related Specimens"
"63","https://sdtm.d4k.dk/ig/RELSUB","a428e003-438c-48b3-a03c-fed8484d7d37","Related Subjects","RELSUB","One record per relationship per related subject per subject","42","Related Subjects"
"64","https://sdtm.d4k.dk/ig/SUPPQUAL","156207b6-b4b8-4944-87c0-4a81ed9231b1","Supplemental Qualifiers for [domain name]","SUPPQUAL","One record per supplemental qualifier per related parent domain record(s)","51","Supplemental Qualifiers for [domain name]"
